wave,item_id,title,description,evidence_path,implementation_status,qa_status,notes
64,ITEM-W64-001,Wave64 strict AI item coverage,Generate current end-to-end AI-operational Items rows for Plan-wide build QA visual review audio review runtime and release control.,Plan/Items/wave64_end_to_end_strict_ai_itemized_list.csv,implemented,validation_passed,Rows require source citations section line range excerpt source key and structured evidence before completion.
64,ITEM-W64-002,Whole-artifact visual review gate,Ensure localized visual work cannot pass if unrelated full-frame defects exist.,Plan/Items/wave64_end_to_end_strict_ai_itemized_list.csv,implemented,validation_passed,Global defects in hands face body lighting background contacts crop artifacts or prompt alignment block promotion.
64,ITEM-W64-003,Whole-artifact audio review gate,Ensure localized audio or visual work cannot pass if full-duration audio defects exist.,Plan/Items/wave64_end_to_end_strict_ai_itemized_list.csv,implemented,validation_passed,Global defects in clipping drift wrong voice ambience missing foley bad timing mix or event mismatch block promotion.
64,ITEM-W64-004,Localized change regression gate,Ensure any mask edit prompt tweak model change rerun audio repair or frame repair is reviewed against the entire artifact.,Plan/Items/wave64_end_to_end_strict_ai_itemized_list.csv,implemented,validation_passed,Target region pass is insufficient without global artifact pass.
64,ITEM-W64-005,Legacy citation integrity audit,Verify legacy Items master rows contain citation file full path section line start line end and excerpt.,Plan/Items/Reports/wave64_end_to_end_strict_ai_coverage_report.json,implemented,validation_passed,Legacy Items master citation required fields report zero missing rows.
