"Timestamp","Wave","Task","Action","Files_Changed","Validation_Run","Result","Evidence_Path","Next_Action"
"2026-07-08T14:55:09-05:00","70","Wave70 0171 contact occlusion Ref_Image_1 rerun and gates passed","Reran TRK/ITEM-W70-0171 with Ref_Image_1 contact actor references and Full context, attached evidence and post-rerun geometry/promotion gates, and kept the row Required_Not_Complete/non-promotional.","Plan/Instructions/QA/Evidence/Mask_Factory/Wave70/W70_CONTACT_OCCLUSION_OWNERSHIP_AUTHORITY_20260708T145450-0500.json; Plan/Instructions/QA/Evidence/Mask_Factory/Wave70/contact_occlusion_ownership_authority.json; Plan/Tracker/Evidence/W70_CONTACT_OCCLUSION_OWNERSHIP_AUTHORITY_20260708T145450-0500.json; Plan/Tracker/Evidence/contact_occlusion_ownership_authority.json; runtime_artifacts/mask_factory/wave70_contact_occlusion_ownership_authority/20260708T145450-0500/contact_occlusion_ownership_authority.json; runtime_artifacts/mask_factory/wave70_contact_occlusion_ownership_authority/20260708T145450-0500/contact_occlusion_ownership_authority_reference_route_panel.png; Plan/Instructions/QA/Evidence/Mask_Factory/Wave70/W70_REF_IMAGE_1_FULL_BODY_REFERENCES_20260708T143650-0500.json; Plan/Instructions/QA/Evidence/Mask_Factory/Wave70/ref_image_1_full_body_references.json; Plan/Instructions/QA/Evidence/Mask_Factory/Wave70/ref_image_1_body_mask_gold_standard.json; Plan/Instructions/QA/Evidence/Mask_Factory/Wave70/W70_MASK_GEOMETRY_HARD_GATE_POST_CONTACT_OCCLUSION_REF_IMAGE_1_20260708T145509-0500.json; Plan/Instructions/QA/Evidence/Mask_Factory/Wave70/W70_MASK_PROMOTION_HARD_GATE_POST_CONTACT_OCCLUSION_REF_IMAGE_1_20260708T145509-0500.json; Plan/Tracker/Evidence/W70_MASK_GEOMETRY_HARD_GATE_POST_CONTACT_OCCLUSION_REF_IMAGE_1_20260708T145509-0500.json; Plan/Tracker/Evidence/W70_MASK_PROMOTION_HARD_GATE_POST_CONTACT_OCCLUSION_REF_IMAGE_1_20260708T145509-0500.json","python py_compile; Ref_Image_1 gold actor manifest validation; Full reference manifest validation; JSON validation; reference panel inspection; Test-Wave70MaskGeometryGate.ps1; Test-Wave70MaskPromotionGate.ps1; CSV row verification","CONTACT_OCCLUSION_REF_IMAGE_1_REFERENCE_AVAILABLE_ROUTE_NOT_COMPLETE_GATES_PASS","Plan/Instructions/QA/Evidence/Mask_Factory/Wave70/W70_CONTACT_OCCLUSION_OWNERSHIP_AUTHORITY_20260708T145450-0500.json","Re-evaluate TRK-W70-0172 / ITEM-W70-0172 body region geometry resolver; no promotion without row-level proof."
"2026-07-08T14:51:01-05:00","70","Wave70 0170 hair body skin Ref_Image_1 rerun and gates passed","Reran TRK/ITEM-W70-0170 with Ref_Image_1 hair/body-skin references and Full context, attached evidence and post-rerun geometry/promotion gates, and kept the row Required_Not_Complete/non-promotional.","Plan/Instructions/QA/Evidence/Mask_Factory/Wave70/W70_HAIR_BODY_SKIN_MARKS_AUTHORITY_20260708T145043-0500.json; Plan/Instructions/QA/Evidence/Mask_Factory/Wave70/hair_body_skin_marks_authority.json; Plan/Tracker/Evidence/W70_HAIR_BODY_SKIN_MARKS_AUTHORITY_20260708T145043-0500.json; Plan/Tracker/Evidence/hair_body_skin_marks_authority.json; runtime_artifacts/mask_factory/wave70_hair_body_skin_marks_authority/20260708T145043-0500/hair_body_skin_marks_authority.json; runtime_artifacts/mask_factory/wave70_hair_body_skin_marks_authority/20260708T145043-0500/hair_body_skin_marks_authority_reference_route_panel.png; Plan/Instructions/QA/Evidence/Mask_Factory/Wave70/W70_REF_IMAGE_1_FULL_BODY_REFERENCES_20260708T143650-0500.json; Plan/Instructions/QA/Evidence/Mask_Factory/Wave70/ref_image_1_full_body_references.json; Plan/Instructions/QA/Evidence/Mask_Factory/Wave70/ref_image_1_body_mask_gold_standard.json; Plan/Instructions/QA/Evidence/Mask_Factory/Wave70/mf70_body_skin_visible_ref_image_1_gold_standard.json; Plan/Instructions/QA/Evidence/Mask_Factory/Wave70/W70_MASK_GEOMETRY_HARD_GATE_POST_HAIR_BODY_SKIN_REF_IMAGE_1_20260708T145101-0500.json; Plan/Instructions/QA/Evidence/Mask_Factory/Wave70/W70_MASK_PROMOTION_HARD_GATE_POST_HAIR_BODY_SKIN_REF_IMAGE_1_20260708T145101-0500.json; Plan/Tracker/Evidence/W70_MASK_GEOMETRY_HARD_GATE_POST_HAIR_BODY_SKIN_REF_IMAGE_1_20260708T145101-0500.json; Plan/Tracker/Evidence/W70_MASK_PROMOTION_HARD_GATE_POST_HAIR_BODY_SKIN_REF_IMAGE_1_20260708T145101-0500.json","python py_compile; Ref_Image_1 gold mask manifest validation; body-skin composite manifest validation; JSON validation; reference panel inspection; Test-Wave70MaskGeometryGate.ps1; Test-Wave70MaskPromotionGate.ps1; CSV row verification","HAIR_BODY_SKIN_REF_IMAGE_1_REFERENCE_AVAILABLE_ROUTE_NOT_COMPLETE_GATES_PASS","Plan/Instructions/QA/Evidence/Mask_Factory/Wave70/W70_HAIR_BODY_SKIN_MARKS_AUTHORITY_20260708T145043-0500.json","Re-evaluate TRK-W70-0171 / ITEM-W70-0171 contact occlusion ownership authority; no promotion without row-level proof."
"2026-07-08T14:47:07-05:00","70","Wave70 0169 feet toes full-reference rerun and gates passed","Reran TRK/ITEM-W70-0169 with Ref_Image_1/Full as body reference input, recorded 7 feet/toes eligible full-body references, excluded the knees-to-head reference, attached 4 foot/toe gold masks and post-rerun gates.","Plan/Instructions/QA/Evidence/Mask_Factory/Wave70/W70_REF_IMAGE_1_FULL_BODY_REFERENCES_20260708T143650-0500.json; Plan/Instructions/QA/Evidence/Mask_Factory/Wave70/ref_image_1_full_body_references.json; Plan/Tracker/Evidence/W70_REF_IMAGE_1_FULL_BODY_REFERENCES_20260708T143650-0500.json; Plan/Tracker/Evidence/ref_image_1_full_body_references.json; runtime_artifacts/mask_factory/ref_image_1_full_body_references/20260708T143650-0500/ref_image_1_full_body_references.json; runtime_artifacts/mask_factory/ref_image_1_full_body_references/20260708T143650-0500/ref_image_1_full_body_references_contact_sheet.png; Plan/Instructions/QA/Evidence/Mask_Factory/Wave70/W70_FEET_TOES_CONTACT_AUTHORITY_20260708T144650-0500.json; Plan/Instructions/QA/Evidence/Mask_Factory/Wave70/feet_toes_authority.json; Plan/Tracker/Evidence/W70_FEET_TOES_CONTACT_AUTHORITY_20260708T144650-0500.json; Plan/Tracker/Evidence/feet_toes_authority.json; runtime_artifacts/mask_factory/wave70_feet_toes_contact_authority/20260708T144650-0500/feet_toes_authority.json; runtime_artifacts/mask_factory/wave70_feet_toes_contact_authority/20260708T144650-0500/feet_toes_contact_authority_reference_route_panel.png; Plan/Instructions/QA/Evidence/Mask_Factory/Wave70/ref_image_1_body_mask_gold_standard.json; Plan/Instructions/QA/Evidence/Mask_Factory/Wave70/W70_MASK_GEOMETRY_HARD_GATE_POST_FEET_TOES_FULL_REF_IMAGE_1_20260708T144707-0500.json; Plan/Instructions/QA/Evidence/Mask_Factory/Wave70/W70_MASK_PROMOTION_HARD_GATE_POST_FEET_TOES_FULL_REF_IMAGE_1_20260708T144707-0500.json; Plan/Tracker/Evidence/W70_MASK_GEOMETRY_HARD_GATE_POST_FEET_TOES_FULL_REF_IMAGE_1_20260708T144707-0500.json; Plan/Tracker/Evidence/W70_MASK_PROMOTION_HARD_GATE_POST_FEET_TOES_FULL_REF_IMAGE_1_20260708T144707-0500.json","python py_compile; Ref_Image_1/Full recursive manifest; Ref_Image_1 foot/toe gold mask manifest validation; JSON validation; reference panel inspection; Test-Wave70MaskGeometryGate.ps1; Test-Wave70MaskPromotionGate.ps1; CSV row verification","FEET_TOES_FULL_REFERENCE_AVAILABLE_ROUTE_NOT_COMPLETE_GATES_PASS","Plan/Instructions/QA/Evidence/Mask_Factory/Wave70/W70_FEET_TOES_CONTACT_AUTHORITY_20260708T144650-0500.json","Re-evaluate TRK-W70-0170 / ITEM-W70-0170 hair/body-skin authority; no promotion without row-level proof."
"2026-07-08T14:43:01-05:00","70","Wave70 0168 limb joint full-reference rerun and gates passed","Reran TRK/ITEM-W70-0168 with Ref_Image_1/Full as body reference input, recorded 8 full/near-full images, 7 lower-limb eligible references, the knees-to-head exception, 15 limb gold masks, and post-rerun geometry/promotion gates.","Plan/Instructions/QA/Evidence/Mask_Factory/Wave70/W70_REF_IMAGE_1_FULL_BODY_REFERENCES_20260708T143650-0500.json; Plan/Instructions/QA/Evidence/Mask_Factory/Wave70/ref_image_1_full_body_references.json; Plan/Tracker/Evidence/W70_REF_IMAGE_1_FULL_BODY_REFERENCES_20260708T143650-0500.json; Plan/Tracker/Evidence/ref_image_1_full_body_references.json; runtime_artifacts/mask_factory/ref_image_1_full_body_references/20260708T143650-0500/ref_image_1_full_body_references.json; runtime_artifacts/mask_factory/ref_image_1_full_body_references/20260708T143650-0500/ref_image_1_full_body_references_contact_sheet.png; Plan/Instructions/QA/Evidence/Mask_Factory/Wave70/W70_LIMB_JOINT_REGION_AUTHORITY_20260708T144246-0500.json; Plan/Instructions/QA/Evidence/Mask_Factory/Wave70/limb_joint_region_authority.json; Plan/Tracker/Evidence/W70_LIMB_JOINT_REGION_AUTHORITY_20260708T144246-0500.json; Plan/Tracker/Evidence/limb_joint_region_authority.json; runtime_artifacts/mask_factory/wave70_limb_joint_region_authority/20260708T144246-0500/limb_joint_region_authority.json; runtime_artifacts/mask_factory/wave70_limb_joint_region_authority/20260708T144246-0500/limb_joint_region_authority_reference_route_panel.png; Plan/Instructions/QA/Evidence/Mask_Factory/Wave70/ref_image_1_body_mask_gold_standard.json; Plan/Instructions/QA/Evidence/Mask_Factory/Wave70/W70_MASK_GEOMETRY_HARD_GATE_POST_LIMB_JOINT_FULL_REF_IMAGE_1_20260708T144301-0500.json; Plan/Instructions/QA/Evidence/Mask_Factory/Wave70/W70_MASK_PROMOTION_HARD_GATE_POST_LIMB_JOINT_FULL_REF_IMAGE_1_20260708T144301-0500.json; Plan/Tracker/Evidence/W70_MASK_GEOMETRY_HARD_GATE_POST_LIMB_JOINT_FULL_REF_IMAGE_1_20260708T144301-0500.json; Plan/Tracker/Evidence/W70_MASK_PROMOTION_HARD_GATE_POST_LIMB_JOINT_FULL_REF_IMAGE_1_20260708T144301-0500.json","python py_compile; Ref_Image_1/Full recursive manifest; Ref_Image_1 gold mask manifest validation; JSON validation; reference panel inspection; Test-Wave70MaskGeometryGate.ps1; Test-Wave70MaskPromotionGate.ps1; CSV row verification","LIMB_JOINT_FULL_REFERENCE_AVAILABLE_ROUTE_NOT_COMPLETE_GATES_PASS","Plan/Instructions/QA/Evidence/Mask_Factory/Wave70/W70_LIMB_JOINT_REGION_AUTHORITY_20260708T144246-0500.json","Re-evaluate TRK-W70-0169 / ITEM-W70-0169 foot/toe authority with eligible full-body refs only; no promotion without row-level proof."
"2026-07-08T14:38:46-05:00","70","Wave70 0167 torso full-reference rerun and gates passed","Reran TRK/ITEM-W70-0167 with Ref_Image_1/Full as body reference input, recorded 8 full/near-full images and the knees-to-head exception, attached torso gold masks and post-rerun geometry/promotion gates, and kept the row Required_Not_Complete/non-promotional.","Plan/Instructions/QA/Evidence/Mask_Factory/Wave70/W70_REF_IMAGE_1_FULL_BODY_REFERENCES_20260708T143650-0500.json; Plan/Instructions/QA/Evidence/Mask_Factory/Wave70/ref_image_1_full_body_references.json; Plan/Tracker/Evidence/W70_REF_IMAGE_1_FULL_BODY_REFERENCES_20260708T143650-0500.json; Plan/Tracker/Evidence/ref_image_1_full_body_references.json; runtime_artifacts/mask_factory/ref_image_1_full_body_references/20260708T143650-0500/ref_image_1_full_body_references.json; runtime_artifacts/mask_factory/ref_image_1_full_body_references/20260708T143650-0500/ref_image_1_full_body_references_contact_sheet.png; Plan/Instructions/QA/Evidence/Mask_Factory/Wave70/W70_TORSO_ABDOMEN_UMBILICUS_AUTHORITY_20260708T143828-0500.json; Plan/Instructions/QA/Evidence/Mask_Factory/Wave70/torso_abdomen_umbilicus_authority.json; Plan/Tracker/Evidence/W70_TORSO_ABDOMEN_UMBILICUS_AUTHORITY_20260708T143828-0500.json; Plan/Tracker/Evidence/torso_abdomen_umbilicus_authority.json; runtime_artifacts/mask_factory/wave70_torso_abdomen_umbilicus_authority/20260708T143828-0500/torso_abdomen_umbilicus_authority.json; runtime_artifacts/mask_factory/wave70_torso_abdomen_umbilicus_authority/20260708T143828-0500/torso_abdomen_umbilicus_authority_reference_route_panel.png; Plan/Instructions/QA/Evidence/Mask_Factory/Wave70/ref_image_1_body_mask_gold_standard.json; Plan/Instructions/QA/Evidence/Mask_Factory/Wave70/W70_MASK_GEOMETRY_HARD_GATE_POST_TORSO_REGION_FULL_REF_IMAGE_1_20260708T143846-0500.json; Plan/Instructions/QA/Evidence/Mask_Factory/Wave70/W70_MASK_PROMOTION_HARD_GATE_POST_TORSO_REGION_FULL_REF_IMAGE_1_20260708T143846-0500.json; Plan/Tracker/Evidence/W70_MASK_GEOMETRY_HARD_GATE_POST_TORSO_REGION_FULL_REF_IMAGE_1_20260708T143846-0500.json; Plan/Tracker/Evidence/W70_MASK_PROMOTION_HARD_GATE_POST_TORSO_REGION_FULL_REF_IMAGE_1_20260708T143846-0500.json","python py_compile; Ref_Image_1/Full recursive manifest; Ref_Image_1 gold mask manifest validation; JSON validation; reference panel inspection; Test-Wave70MaskGeometryGate.ps1; Test-Wave70MaskPromotionGate.ps1; CSV row verification","TORSO_FULL_REFERENCE_AVAILABLE_ROUTE_NOT_COMPLETE_GATES_PASS","Plan/Instructions/QA/Evidence/Mask_Factory/Wave70/W70_TORSO_ABDOMEN_UMBILICUS_AUTHORITY_20260708T143828-0500.json","Re-evaluate TRK-W70-0168 / ITEM-W70-0168 limb joint authority with Ref_Image_1/Full and gold masks; no promotion without row-level proof."
"2026-07-08T14:27:40-05:00","70","Wave70 0166 human part parsing Ref_Image_1 rerun and gates passed","Reran TRK/ITEM-W70-0166 human-part parsing authority, recorded that local parser routes still do not produce semantic full-body part parsing, captured Ref_Image_1 labeled masks as reference-only evidence, attached post-rerun geometry and promotion gate evidence, and kept masks non-promotional.","Plan/Instructions/QA/Evidence/Mask_Factory/Wave70/W70_HUMAN_PART_PARSING_AUTHORITY_20260708T142544-0500.json; Plan/Instructions/QA/Evidence/Mask_Factory/Wave70/human_part_parsing_authority.json; Plan/Tracker/Evidence/W70_HUMAN_PART_PARSING_AUTHORITY_20260708T142544-0500.json; Plan/Tracker/Evidence/human_part_parsing_authority.json; runtime_artifacts/mask_factory/wave70_human_part_parsing_authority/20260708T142544-0500/human_part_parsing_authority.json; runtime_artifacts/mask_factory/wave70_human_part_parsing_authority/20260708T142544-0500/human_part_parsing_authority_blocker_panel.png; Plan/Instructions/QA/Evidence/Mask_Factory/Wave70/ref_image_1_body_mask_gold_standard.json; Plan/Instructions/QA/Evidence/Mask_Factory/Wave70/W70_MASK_GEOMETRY_HARD_GATE_POST_HUMAN_PART_PARSING_REF_IMAGE_1_20260708T142740-0500.json; Plan/Instructions/QA/Evidence/Mask_Factory/Wave70/W70_MASK_PROMOTION_HARD_GATE_POST_HUMAN_PART_PARSING_REF_IMAGE_1_20260708T142740-0500.json; Plan/Tracker/Evidence/W70_MASK_GEOMETRY_HARD_GATE_POST_HUMAN_PART_PARSING_REF_IMAGE_1_20260708T142740-0500.json; Plan/Tracker/Evidence/W70_MASK_PROMOTION_HARD_GATE_POST_HUMAN_PART_PARSING_REF_IMAGE_1_20260708T142740-0500.json","python py_compile; local ControlNet Aux parser route probes; Ref_Image_1 manifest validation; JSON validation; panel inspection; Test-Wave70MaskGeometryGate.ps1; Test-Wave70MaskPromotionGate.ps1; CSV row verification","HUMAN_PART_PARSING_REF_IMAGE_1_REFERENCE_ONLY_LOCKDOWN_GATES_PASS","Plan/Instructions/QA/Evidence/Mask_Factory/Wave70/W70_HUMAN_PART_PARSING_AUTHORITY_20260708T142544-0500.json","Re-evaluate TRK-W70-0167 / ITEM-W70-0167 torso region authority with active-source and Ref_Image_1 contexts separate."
"2026-07-08T14:23:06-05:00","70","Wave70 0165 hand finger authority Ref_Image_1 rerun and gates passed","Reran TRK/ITEM-W70-0165 with local MediaPipe HandLandmarker, detected zero active-source hands, recorded eight Ref_Image_1 hand/finger gold masks as reference-only evidence, attached post-rerun geometry and promotion gate evidence, and kept hand/finger masks non-promotional.","Plan/Instructions/QA/Evidence/Mask_Factory/Wave70/W70_HAND_FINGER_LANDMARK_AUTHORITY_20260708T142210-0500.json; Plan/Instructions/QA/Evidence/Mask_Factory/Wave70/hand_finger_landmark_authority.json; Plan/Tracker/Evidence/W70_HAND_FINGER_LANDMARK_AUTHORITY_20260708T142210-0500.json; Plan/Tracker/Evidence/hand_finger_landmark_authority.json; runtime_artifacts/mask_factory/wave70_hand_finger_landmark_authority/20260708T142210-0500/hand_finger_landmark_authority.json; runtime_artifacts/mask_factory/wave70_hand_finger_landmark_authority/20260708T142210-0500/hand_finger_landmark_authority_panel.png; Plan/Instructions/QA/Evidence/Mask_Factory/Wave70/ref_image_1_body_mask_gold_standard.json; Plan/Instructions/QA/Evidence/Mask_Factory/Wave70/W70_MASK_GEOMETRY_HARD_GATE_POST_HAND_FINGER_AUTHORITY_REF_IMAGE_1_20260708T142306-0500.json; Plan/Instructions/QA/Evidence/Mask_Factory/Wave70/W70_MASK_PROMOTION_HARD_GATE_POST_HAND_FINGER_AUTHORITY_REF_IMAGE_1_20260708T142306-0500.json; Plan/Tracker/Evidence/W70_MASK_GEOMETRY_HARD_GATE_POST_HAND_FINGER_AUTHORITY_REF_IMAGE_1_20260708T142306-0500.json; Plan/Tracker/Evidence/W70_MASK_PROMOTION_HARD_GATE_POST_HAND_FINGER_AUTHORITY_REF_IMAGE_1_20260708T142306-0500.json","python py_compile; MediaPipe HandLandmarker inference; Ref_Image_1 manifest validation; JSON validation; panel inspection; Test-Wave70MaskGeometryGate.ps1; Test-Wave70MaskPromotionGate.ps1; CSV row verification","HAND_FINGER_AUTHORITY_REF_IMAGE_1_REFERENCE_ONLY_LOCKDOWN_GATES_PASS","Plan/Instructions/QA/Evidence/Mask_Factory/Wave70/W70_HAND_FINGER_LANDMARK_AUTHORITY_20260708T142210-0500.json","Re-evaluate TRK-W70-0166 / ITEM-W70-0166 human-part parsing; keep face/lip parsing assets separate from full-body parser proof."
"2026-07-08T14:18:39-05:00","70","Wave70 0164 pose landmark authority rerun and gates passed","Reran TRK/ITEM-W70-0164 with current local MediaPipe pose asset, produced one portrait person, 33 pose landmarks, and one segmentation mask, preserved partial/non-promotional status, attached post-rerun geometry and promotion gate evidence, and kept whole-body authority blocked.","Plan/Instructions/QA/Evidence/Mask_Factory/Wave70/W70_POSE_LANDMARK_AUTHORITY_20260708T141735-0500.json; Plan/Instructions/QA/Evidence/Mask_Factory/Wave70/pose_landmark_authority.json; Plan/Tracker/Evidence/W70_POSE_LANDMARK_AUTHORITY_20260708T141735-0500.json; Plan/Tracker/Evidence/pose_landmark_authority.json; runtime_artifacts/mask_factory/wave70_pose_landmark_authority/20260708T141735-0500/pose_landmark_authority.json; runtime_artifacts/mask_factory/wave70_pose_landmark_authority/20260708T141735-0500/pose_landmark_authority_panel.png; Plan/Instructions/QA/Evidence/Mask_Factory/Wave70/W70_MASK_GEOMETRY_HARD_GATE_POST_POSE_LANDMARK_AUTHORITY_RERUN_20260708T141839-0500.json; Plan/Instructions/QA/Evidence/Mask_Factory/Wave70/W70_MASK_PROMOTION_HARD_GATE_POST_POSE_LANDMARK_AUTHORITY_RERUN_20260708T141839-0500.json; Plan/Tracker/Evidence/W70_MASK_GEOMETRY_HARD_GATE_POST_POSE_LANDMARK_AUTHORITY_RERUN_20260708T141839-0500.json; Plan/Tracker/Evidence/W70_MASK_PROMOTION_HARD_GATE_POST_POSE_LANDMARK_AUTHORITY_RERUN_20260708T141839-0500.json","python py_compile; MediaPipe PoseLandmarker inference; JSON validation; panel inspection; Test-Wave70MaskGeometryGate.ps1; Test-Wave70MaskPromotionGate.ps1; CSV row verification","POSE_LANDMARK_AUTHORITY_PARTIAL_RERUN_LOCKDOWN_GATES_PASS","Plan/Instructions/QA/Evidence/Mask_Factory/Wave70/W70_POSE_LANDMARK_AUTHORITY_20260708T141735-0500.json","Re-evaluate TRK-W70-0165 / ITEM-W70-0165 hand/finger authority with active-source and Ref_Image_1 contexts kept separate."
"2026-07-08T14:15:12-05:00","70","Wave70 0162 whole-body dependency probe refreshed and gates passed","Reran TRK/ITEM-W70-0162 current-state whole-body dependency probe, detected local pose/hand/SAM assets as available but runtime-unvalidated, preserved fail-closed blockers for human parsing, person-instance segmentation, temporal propagation, and contact ownership, attached post-probe hard-gate evidence, and kept all masks non-promotional.","Plan/Instructions/QA/Evidence/Mask_Factory/Wave70/W70_WHOLE_BODY_GEOMETRY_DEPENDENCY_PROBE_20260708T141411-0500.json; Plan/Instructions/QA/Evidence/Mask_Factory/Wave70/body_geometry_dependency_probe.json; Plan/Tracker/Evidence/W70_WHOLE_BODY_GEOMETRY_DEPENDENCY_PROBE_20260708T141411-0500.json; Plan/Tracker/Evidence/body_geometry_dependency_probe.json; runtime_artifacts/mask_factory/wave70_whole_body_geometry_dependency_probe/20260708T141411-0500/body_geometry_dependency_probe.json; runtime_artifacts/mask_factory/wave70_whole_body_geometry_dependency_probe/20260708T141411-0500/body_geometry_dependency_probe_panel.png; Plan/Instructions/QA/Evidence/Mask_Factory/Wave70/W70_MASK_GEOMETRY_HARD_GATE_POST_WHOLE_BODY_DEPENDENCY_PROBE_20260708T141512-0500.json; Plan/Instructions/QA/Evidence/Mask_Factory/Wave70/W70_MASK_PROMOTION_HARD_GATE_POST_WHOLE_BODY_DEPENDENCY_PROBE_20260708T141512-0500.json; Plan/Tracker/Evidence/W70_MASK_GEOMETRY_HARD_GATE_POST_WHOLE_BODY_DEPENDENCY_PROBE_20260708T141512-0500.json; Plan/Tracker/Evidence/W70_MASK_PROMOTION_HARD_GATE_POST_WHOLE_BODY_DEPENDENCY_PROBE_20260708T141512-0500.json","python py_compile; dependency/model-file scan; JSON validation; panel inspection; Test-Wave70MaskGeometryGate.ps1; Test-Wave70MaskPromotionGate.ps1; CSV row verification","WHOLE_BODY_DEPENDENCY_PROBE_REFINED_BLOCKER_LOCKDOWN_GATES_PASS","Plan/Instructions/QA/Evidence/Mask_Factory/Wave70/W70_WHOLE_BODY_GEOMETRY_DEPENDENCY_PROBE_20260708T141411-0500.json","Re-evaluate TRK-W70-0164 / ITEM-W70-0164 pose landmark authority with current local pose assets; do not promote masks."
"2026-07-08T14:06:17-05:00","70","Wave70 0159 Ref_Image_1 body skin post-evaluation gates","Ran post-Ref_Image_1 geometry and promotion hard gates for TRK/ITEM-W70-0159, attached gate evidence, preserved the corrected top-strip partial-body rule, and kept the row Required_Not_Complete/non-promotional.","Plan/Instructions/QA/Evidence/Mask_Factory/Wave70/W70_MASK_GEOMETRY_HARD_GATE_POST_MF70_BODY_SKIN_VISIBLE_REF_IMAGE_1_20260708T140617-0500.json; Plan/Instructions/QA/Evidence/Mask_Factory/Wave70/W70_MASK_PROMOTION_HARD_GATE_POST_MF70_BODY_SKIN_VISIBLE_REF_IMAGE_1_20260708T140617-0500.json; Plan/Tracker/Evidence/W70_MASK_GEOMETRY_HARD_GATE_POST_MF70_BODY_SKIN_VISIBLE_REF_IMAGE_1_20260708T140617-0500.json; Plan/Tracker/Evidence/W70_MASK_PROMOTION_HARD_GATE_POST_MF70_BODY_SKIN_VISIBLE_REF_IMAGE_1_20260708T140617-0500.json; Plan/Instructions/QA/Evidence/Mask_Factory/Wave70/mf70_body_skin_visible_ref_image_1_gold_standard.json; runtime_artifacts/mask_factory/wave70_mf70_body_skin_visible_ref_image_1/20260708T140318-0500/mf70_body_skin_visible_ref_image_1_gold_standard_panel.png","Test-Wave70MaskGeometryGate.ps1; Test-Wave70MaskPromotionGate.ps1; JSON validation; panel inspection; CSV row verification","REF_IMAGE_1_BODY_SKIN_VISIBLE_GATES_PASS_ROUTE_NOT_COMPLETE","Plan/Instructions/QA/Evidence/Mask_Factory/Wave70/mf70_body_skin_visible_ref_image_1_gold_standard.json","Work TRK-W70-0162 / ITEM-W70-0162 local whole-body dependency/model probe; do not promote masks."
"2026-07-08T14:03:18-05:00","70","Wave70 0159 Ref_Image_1 body skin composite evaluation","Built and validated a Ref_Image_1 composite visible-body-skin gold reference from labeled skin/body-part overlays while keeping TRK/ITEM-W70-0159 Required_Not_Complete and non-promotional.","Plan/Instructions/QA/Evidence/Mask_Factory/Wave70/W70_MF70_BODY_SKIN_VISIBLE_REF_IMAGE_1_GOLD_STANDARD_20260708T140318-0500.json; Plan/Instructions/QA/Evidence/Mask_Factory/Wave70/mf70_body_skin_visible_ref_image_1_gold_standard.json; Plan/Tracker/Evidence/W70_MF70_BODY_SKIN_VISIBLE_REF_IMAGE_1_GOLD_STANDARD_20260708T140318-0500.json; Plan/Tracker/Evidence/mf70_body_skin_visible_ref_image_1_gold_standard.json; runtime_artifacts/mask_factory/wave70_mf70_body_skin_visible_ref_image_1/20260708T140318-0500/mf70_body_skin_visible_ref_image_1_gold_standard.json; runtime_artifacts/mask_factory/wave70_mf70_body_skin_visible_ref_image_1/20260708T140318-0500/mf70_body_skin_visible_ref_image_1_gold_standard_panel.png; runtime_artifacts/mask_factory/wave70_mf70_body_skin_visible_ref_image_1/20260708T140318-0500/mf70_body_skin_visible_ref_image_1_layout_1_1448x1086_composite_mask.png; runtime_artifacts/mask_factory/wave70_mf70_body_skin_visible_ref_image_1/20260708T140318-0500/mf70_body_skin_visible_ref_image_1_layout_2_1619x971_composite_mask.png; runtime_artifacts/mask_factory/wave70_mf70_body_skin_visible_ref_image_1/20260708T140318-0500/mf70_body_skin_visible_ref_image_1_layout_2_composite_preview.png; Plan/Instructions/QA/Evidence/Mask_Factory/Wave70/ref_image_1_body_mask_gold_standard.json; runtime_artifacts/mask_factory/ref_image_1_body_mask_gold_standard/20260708T133754-0500/extracted_binary_masks/arms_upper_arms.png; runtime_artifacts/mask_factory/ref_image_1_body_mask_gold_standard/20260708T133754-0500/extracted_binary_masks/arms_lower_arm_fore_arms.png; runtime_artifacts/mask_factory/ref_image_1_body_mask_gold_standard/20260708T133754-0500/extracted_binary_masks/hands_both_hands.png; runtime_artifacts/mask_factory/ref_image_1_body_mask_gold_standard/20260708T133754-0500/extracted_binary_masks/breasts_both.png; runtime_artifacts/mask_factory/ref_image_1_body_mask_gold_standard/20260708T133754-0500/extracted_binary_masks/abdomen_stomach.png; runtime_artifacts/mask_factory/ref_image_1_body_mask_gold_standard/20260708T133754-0500/extracted_binary_masks/pelvic_pelvic_region.png; runtime_artifacts/mask_factory/ref_image_1_body_mask_gold_standard/20260708T133754-0500/extracted_binary_masks/glute_both.png; runtime_artifacts/mask_factory/ref_image_1_body_mask_gold_standard/20260708T133754-0500/extracted_binary_masks/thigh_both_thighs.png; runtime_artifacts/mask_factory/ref_image_1_body_mask_gold_standard/20260708T133754-0500/extracted_binary_masks/calves_both_calves.png; runtime_artifacts/mask_factory/ref_image_1_body_mask_gold_standard/20260708T133754-0500/extracted_binary_masks/feet_both_feet.png; runtime_artifacts/mask_factory/ref_image_1_body_mask_gold_standard/20260708T133754-0500/extracted_binary_masks/feet_toes_feet.png","python py_compile; manifest JSON validation; component mask existence/hash validation; composite mask generation; panel visual review; Wave70 geometry/promotion gates pending","REF_IMAGE_1_BODY_SKIN_COMPOSITE_GOLD_MASK_AVAILABLE_ROUTE_NOT_COMPLETE","Plan/Instructions/QA/Evidence/Mask_Factory/Wave70/mf70_body_skin_visible_ref_image_1_gold_standard.json","Identify and work next required Wave70 mask-factory row with Ref_Image_1 gold masks."
