Timestamp,Wave,Task,Action,Files_Changed,Validation_Run,Result,Evidence_Path,Next_Action
Package creation,58,Autonomous Instruction Brain,Generated seven core instruction files plus hydration/report/manifest artifacts,Plan/Instructions/*,Static package validation,PASS,Reports/WAVE58_VALIDATION_REPORT.json,Begin Wave 59
2026-07-06T04:53:12Z,59,Built directory/index/catalogue awareness layer,Plan/Instructions/Indexes and Wave59 reports,static_complete
2026-07-06,62,Created hydration/rehydration finalization system,Plan/Instructions/Hydration_Rehydration,completed
2026-07-06,62,Created final Wave 58-62 completion certification,Plan/Instructions/Hydration_Rehydration/WAVE58_62_FINAL_COMPLETION_CERTIFICATION.md,completed
2026-07-06T00:36:08-05:00,59,Live local directory/index validation,"Patched generator compatibility, regenerated live indexes, validated JSON/CSV counts, and confirmed .env exclusion","Plan/Instructions/Scripts/Generate-Project-Indexes.ps1; Plan/Instructions/Indexes/Generated/*; Plan/Instructions/QA/Evidence/Index_Validation/W59_LIVE_INDEX_REGENERATION_20260706T003608-0500.json","Generate-Project-Indexes.ps1; ConvertFrom-Json; Import-Csv secret exclusion check",PASS_WITH_NOTES,Plan/Instructions/QA/Evidence/Index_Validation/W59_LIVE_INDEX_REGENERATION_20260706T003608-0500.json,Proceed to live Git status verification or next local validation per tracker priority
2026-07-06T00:42:00-05:00,59/60,Secret-safe local Git verification,"Confirmed C:\Comfy_UI_Main lacks .git metadata; created and validated .gitignore and .env.example secret guards",".gitignore; .env.example; Plan/Instructions/QA/Evidence/Git_Verification/W59_W60_GIT_LOCAL_VERIFICATION_20260706T004200-0500.json","Git root/branch/HEAD checks; filesystem secret guard validation",BLOCKED,Plan/Instructions/QA/Evidence/Git_Verification/W59_W60_GIT_LOCAL_VERIFICATION_20260706T004200-0500.json,Select Git recovery task or continue local non-Git validation
2026-07-06T00:46:32-05:00,60,Operations static validation,"Parsed 7 PowerShell helpers, parsed 5 schema/template JSON files, and smoke-tested New-ModelRegistryRecord locally","Plan/Instructions/Operations/Scripts; Plan/Instructions/Operations/Schemas; Plan/Instructions/Operations/Templates; Plan/Instructions/QA/Evidence/Operations_Static_Validation/W60_OPERATIONS_STATIC_VALIDATION_20260706T004632-0500.json","PowerShell parser; ConvertFrom-Json; New-ModelRegistryRecord smoke test",PASS_WITH_NOTES,Plan/Instructions/QA/Evidence/Operations_Static_Validation/W60_OPERATIONS_STATIC_VALIDATION_20260706T004632-0500.json,Select next local validation or dedicated external-resource task
2026-07-06T00:51:11-05:00,61,QA helper static validation,"Parsed QA helper scripts, parsed schemas/templates, checked markdown templates, and generated sample QA/done-cert records","Plan/Instructions/QA/Scripts; Plan/Instructions/QA/Schemas; Plan/Instructions/QA/Templates; Plan/Instructions/QA/Evidence/QA_Helper_Static_Validation/W61_QA_HELPER_STATIC_VALIDATION_20260706T005111-0500.json","PowerShell parser; ConvertFrom-Json; helper smoke tests",PASS_WITH_NOTES,Plan/Instructions/QA/Evidence/QA_Helper_Static_Validation/W61_QA_HELPER_STATIC_VALIDATION_20260706T005111-0500.json,Select next local validation or dedicated runtime/external-resource task
2026-07-06T00:54:25-05:00,62,Hydration helper static validation,"Parsed hydration helper scripts/templates, generated sample session state, and recorded cumulative zip validation as pending because no zip was found","Plan/Instructions/Hydration_Rehydration/Scripts; Plan/Instructions/Hydration_Rehydration/Templates; Plan/Instructions/QA/Evidence/Hydration_Helper_Static_Validation/W62_HYDRATION_HELPER_STATIC_VALIDATION_20260706T005425-0500.json","PowerShell parser; ConvertFrom-Json; Import-Csv; New-SessionState smoke test; zip search",PASS_WITH_PENDING_VALIDATION,Plan/Instructions/QA/Evidence/Hydration_Helper_Static_Validation/W62_HYDRATION_HELPER_STATIC_VALIDATION_20260706T005425-0500.json,Continue local validation or restore/create cumulative zip before pack test
2026-07-06T01:06:03-05:00,59/60,Git recovery initial commit and push,"Initialized Git, configured origin, enabled LFS for oversized CSVs, committed project state, pushed main, and verified remote HEAD",".git; .gitattributes; .gitignore; .env.example; Plan; Plan/Instructions/QA/Evidence/Git_Verification/W59_W60_GIT_RECOVERY_INITIAL_COMMIT_20260706T010603-0500.json","git init; git fetch; git lfs install; staged secret scan; git commit; git push; git ls-remote",PASS,Plan/Instructions/QA/Evidence/Git_Verification/W59_W60_GIT_RECOVERY_INITIAL_COMMIT_20260706T010603-0500.json,Commit and push the recovery evidence/tracker update
2026-07-06T01:10:16-05:00,59/60,Git recovery evidence commit verification,"Verified the Git recovery evidence/tracker commit is present locally and on origin/main with clean status","Plan/Instructions/Hydration_Rehydration; Plan/Instructions/QA/Evidence/Git_Verification/W59_W60_GIT_RECOVERY_EVIDENCE_COMMIT_VERIFICATION_20260706T011016-0500.json","git status --branch --short; git rev-parse HEAD; git ls-remote origin refs/heads/main",PASS,Plan/Instructions/QA/Evidence/Git_Verification/W59_W60_GIT_RECOVERY_EVIDENCE_COMMIT_VERIFICATION_20260706T011016-0500.json,Resolve or create cumulative zip for Wave 62 pack validation
2026-07-06T01:15:48-05:00,62,Cumulative pack build and validation,"Built final Wave 58-62 cumulative zip from tracked project files with private-path guard and official pack validation","Comfy_UI_Main_Autonomous_Codex_Desktop_Waves58_62_Cumulative.zip; .gitattributes; Plan/Instructions/QA/Evidence/Hydration_Helper_Static_Validation/W62_CUMULATIVE_PACK_VALIDATION_20260706T011548-0500.json","git ls-files package build; private path guard; git grep token scan; Test-CumulativeWavePack.ps1",PASS,Plan/Instructions/QA/Evidence/Hydration_Helper_Static_Validation/W62_CUMULATIVE_PACK_VALIDATION_20260706T011548-0500.json,Run secret-safe runtime readiness preflight
2026-07-06T01:23:01-05:00,60/61,Runtime readiness preflight,"Validated GitHub API AWS account EC2 identity EBS volume Civitai metadata endpoint and local ComfyUI/runtime inventory without printing secrets or starting EC2","Plan/Instructions/QA/Evidence/Runtime_Readiness/W60_W61_RUNTIME_READINESS_PREFLIGHT_20260706T012301-0500.json","redacted .env key presence; git status/remote; GitHub API; aws sts; aws ec2 describe-instances; aws ec2 describe-volumes; Civitai metadata; local path inventory",PASS_WITH_LOCAL_RUNTIME_BLOCKER,Plan/Instructions/QA/Evidence/Runtime_Readiness/W60_W61_RUNTIME_READINESS_PREFLIGHT_20260706T012301-0500.json,Create bounded EC2 runtime discovery run and stop plan
2026-07-06T01:46:30-05:00,60/61,Bounded EC2 runtime discovery,"Started verified EC2 instance ran SSM GPU and path discovery found /home/ubuntu/ComfyUI found no Comfy_UI_Main checkout then stopped and verified stopped","Plan/Instructions/Operations/Run_Records/aws_gpu_run_20260706T012748-0500.json; Plan/Instructions/QA/Evidence/EC2_Runtime_Discovery/W60_W61_EC2_RUNTIME_DISCOVERY_20260706T012748-0500.json","aws ec2 start-instances; status checks; aws ssm describe-instance-information; aws ssm send-command; aws ec2 stop-instances",PASS_WITH_PROJECT_SYNC_REQUIRED,Plan/Instructions/QA/Evidence/EC2_Runtime_Discovery/W60_W61_EC2_RUNTIME_DISCOVERY_20260706T012748-0500.json,Run bounded EC2 project sync then stop verification
2026-07-06T01:59:07-05:00,60/61,Bounded EC2 project sync,"Started verified EC2 instance cloned Comfy_UI_Main to /home/ubuntu/Comfy_UI_Main pulled Git LFS verified matching HEAD and .env absence then stopped and verified stopped","Plan/Instructions/Operations/Run_Records/aws_gpu_run_20260706T015022-0500.json; Plan/Instructions/QA/Evidence/EC2_Project_Sync/W60_W61_EC2_PROJECT_SYNC_20260706T015022-0500.json","aws ec2 start-instances; aws ssm send-command; git clone; git lfs pull; git status; aws ec2 stop-instances",PASS,Plan/Instructions/QA/Evidence/EC2_Project_Sync/W60_W61_EC2_PROJECT_SYNC_20260706T015022-0500.json,Run bounded EC2 ComfyUI model workflow inventory
2026-07-06T02:10:57-05:00,60/61,Bounded EC2 runtime inventory,"Started verified EC2 instance updated remote project inventoried ComfyUI model folders custom nodes runtime requirements and stopped verified stopped","Plan/Instructions/Operations/Run_Records/aws_gpu_run_20260706T020209-0500.json; Plan/Instructions/QA/Evidence/EC2_Runtime_Inventory/W60_W61_EC2_RUNTIME_INVENTORY_20260706T020209-0500.json","aws ec2 start-instances; aws ssm send-command; git pull; git lfs pull; model folder inventory; runtime requirement inventory; aws ec2 stop-instances",PASS,Plan/Instructions/QA/Evidence/EC2_Runtime_Inventory/W60_W61_EC2_RUNTIME_INVENTORY_20260706T020209-0500.json,Select lowest-risk workflow lane for bounded execution
2026-07-06T02:40:25-05:00,61,Workflow lane selection and graph authoring,"Selected sdxl_low_risk_fallback_lane authored workflow.api.json patch_points.json runtime_requirements.json and smoke_test_request.json then recorded AWS login expiry before EC2 hash object_info execution proof","Plan/07_IMPLEMENTATION/workflow_templates/base_generation/sdxl_low_risk_fallback_lane; Plan/Instructions/QA/Evidence/Workflow_Prerequisite_Matching/W61_WORKFLOW_LANE_SELECTION_20260706T024025-0500.json; Plan/Instructions/Operations/Run_Records/aws_gpu_run_20260706T022710-0500.json","ConvertFrom-Json on authored workflow files; EC2 stop verification; AWS sts/ec2 auth checks",SELECTED_PENDING_RUNTIME_VALIDATION,Plan/Instructions/QA/Evidence/Workflow_Prerequisite_Matching/W61_WORKFLOW_LANE_SELECTION_20260706T024025-0500.json,Refresh AWS CLI default login then rerun EC2 static lane proof
2026-07-06T02:48:46-05:00,61,SDXL workflow static validation,"Added reusable local ComfyUI workflow static validator and EC2 lane static proof helper then validated sdxl_low_risk_fallback_lane graph references patch points required nodes checkpoint reference and dry-run EC2 proof plan","Plan/Instructions/QA/Scripts/Test-ComfyWorkflowStatic.ps1; Plan/Instructions/Operations/Scripts/Invoke-EC2LaneStaticProof.ps1; Plan/Instructions/QA/Evidence/Workflow_Static_Validation/W61_SDXL_LOW_RISK_WORKFLOW_STATIC_VALIDATION_20260706T024811-0500.json","PowerShell parser; Test-ComfyWorkflowStatic.ps1; Invoke-EC2LaneStaticProof.ps1 dry-run",PASS_STATIC_ONLY,Plan/Instructions/QA/Evidence/Workflow_Static_Validation/W61_SDXL_LOW_RISK_WORKFLOW_STATIC_VALIDATION_20260706T024811-0500.json,Refresh AWS CLI default login then run EC2 static proof with -Execute
2026-07-06T02:55:36-05:00,61,ComfyUI smoke helper dry run,"Added bounded ComfyUI workflow smoke helper and generated the patched /prompt request body for sdxl_low_risk_fallback_lane without starting EC2 or running generation","Plan/Instructions/Operations/Scripts/Invoke-ComfyWorkflowSmoke.ps1; Plan/Instructions/QA/Evidence/Workflow_Static_Validation/W61_COMFY_WORKFLOW_SMOKE_DRY_RUN_20260706T025536-0500.json; Plan/Instructions/QA/Evidence/Workflow_Static_Validation/W61_COMFY_WORKFLOW_SMOKE_REQUEST_20260706T025536-0500.json","PowerShell parser; Invoke-ComfyWorkflowSmoke.ps1 dry-run; ConvertFrom-Json",PASS_STATIC_ONLY,Plan/Instructions/QA/Evidence/Workflow_Static_Validation/W61_COMFY_WORKFLOW_SMOKE_DRY_RUN_20260706T025536-0500.json,After EC2 static proof run smoke helper with -Execute against running ComfyUI API
2026-07-06T03:00:37-05:00,61,Image artifact QA helper dry run,"Added image artifact QA helper and generated pending-artifact QA record plus checklist for the future SDXL smoke output without claiming visual review","Plan/Instructions/QA/Scripts/New-ImageArtifactQARecord.ps1; Plan/Instructions/QA/Evidence/Image_Artifact_QA/W61_IMAGE_QA_DRY_RUN_20260706T030037-0500.json; Plan/Instructions/QA/Evidence/Image_Artifact_QA/W61_IMAGE_QA_CHECKLIST_DRY_RUN_20260706T030037-0500.md","PowerShell parser; New-ImageArtifactQARecord.ps1 dry-run; temporary PNG technical-inspection smoke test; ConvertFrom-Json",PASS_STATIC_ONLY,Plan/Instructions/QA/Evidence/Image_Artifact_QA/W61_IMAGE_QA_DRY_RUN_20260706T030037-0500.json,After generated image pullback run image QA helper on real artifact then complete visual review
2026-07-06T03:10:07-05:00,60/61,AWS auth gate blocker evidence,"Added Test-AwsAuthGate.ps1 and recorded redacted AWS auth evidence; aws login --remote requires browser authorization and this non-interactive shell cannot provide the code","Plan/Instructions/Operations/Scripts/Test-AwsAuthGate.ps1; Plan/Instructions/QA/Evidence/Runtime_Readiness/W60_W61_AWS_AUTH_GATE_20260706T031007-0500.json; Plan/Instructions/QA/Evidence/Done_Certifications/CERT_W60_W61_AWS_AUTH_GATE_HELPER_20260706T031007-0500.md","PowerShell parser; Test-AwsAuthGate.ps1 -AttemptRemoteLogin; ConvertFrom-Json; redaction check",BLOCKED_EXTERNAL_AUTH_RECORDED,Plan/Instructions/QA/Evidence/Runtime_Readiness/W60_W61_AWS_AUTH_GATE_20260706T031007-0500.json,Complete AWS remote browser login externally then rerun auth gate before EC2 static proof
2026-07-06T03:17:58-05:00,60,EC2 pullback record helper dry run,"Added New-EC2PullbackRecord.ps1 to create local PULLBACK_RECORD-style metadata with file counts hashes remote manifest comparison and QA routing after runtime artifact pullback","Plan/Instructions/Operations/Scripts/New-EC2PullbackRecord.ps1; Plan/Instructions/QA/Evidence/Runtime_Readiness/W60_EC2_PULLBACK_RECORD_DRY_RUN_20260706T031758-0500.json; Plan/Instructions/QA/Evidence/Done_Certifications/CERT_W60_EC2_PULLBACK_RECORD_HELPER_DRY_RUN_20260706T031758-0500.md","PowerShell parser; dry-run record generation; temporary manifest/hash smoke test; ConvertFrom-Json",PASS_STATIC_ONLY,Plan/Instructions/QA/Evidence/Runtime_Readiness/W60_EC2_PULLBACK_RECORD_DRY_RUN_20260706T031758-0500.json,After smoke execution pull artifacts back locally then run New-EC2PullbackRecord before modality QA
2026-07-06T03:23:45-05:00,61,Selected lane runtime readiness gate,"Added Test-LaneRuntimeReadiness.ps1 and recorded that the selected SDXL lane is locally ready for EC2 static proof but blocked by AWS auth and missing object-info/path/hash proof","Plan/Instructions/Operations/Scripts/Test-LaneRuntimeReadiness.ps1; Plan/Instructions/QA/Evidence/Runtime_Readiness/W61_LANE_RUNTIME_READINESS_20260706T032345-0500.json; Plan/Instructions/QA/Evidence/Done_Certifications/CERT_W61_LANE_RUNTIME_READINESS_LOCAL_GATE_20260706T032345-0500.md","PowerShell parser; lane JSON validation; helper parser validation; evidence JSON validation; auth gate inspection",LOCAL_PRE_EC2_READY_RUNTIME_BLOCKED,Plan/Instructions/QA/Evidence/Runtime_Readiness/W61_LANE_RUNTIME_READINESS_20260706T032345-0500.json,Complete AWS browser login rerun auth gate then EC2 static proof
2026-07-06T03:39:29-05:00,60/61,EC2 workflow smoke-run coordinator dry run,"Added Invoke-EC2WorkflowSmokeRun.ps1 to coordinate auth/readiness/static-proof gates, remote ComfyUI prompt execution, artifact manifest creation, optional S3 pullback, and stop verification; dry-run built the request and refused EC2 start/generation because auth/static proof are missing","Plan/Instructions/Operations/Scripts/Invoke-EC2WorkflowSmokeRun.ps1; Plan/Instructions/QA/Evidence/Workflow_Runtime/W61_EC2_WORKFLOW_SMOKE_RUN_DRY_RUN_20260706T033928-0500.json; Plan/Instructions/QA/Evidence/Workflow_Runtime/W61_EC2_WORKFLOW_SMOKE_RUN_REQUEST_20260706T033928-0500.json; Plan/Instructions/QA/Evidence/Runtime_Readiness/W61_LANE_RUNTIME_READINESS_20260706T033522-0500.json; Plan/Instructions/QA/Evidence/Done_Certifications/CERT_W61_EC2_WORKFLOW_SMOKE_RUN_HELPER_DRY_RUN_20260706T033928-0500.md","PowerShell parser; Invoke-EC2WorkflowSmokeRun.ps1 dry-run; patched request JSON parse; Test-LaneRuntimeReadiness.ps1 rerun",GATED_NO_START_NO_GENERATION,Plan/Instructions/QA/Evidence/Workflow_Runtime/W61_EC2_WORKFLOW_SMOKE_RUN_DRY_RUN_20260706T033928-0500.json,Refresh AWS auth rerun readiness run EC2 static proof then execute coordinator
2026-07-06T03:45:16-05:00,60/61,EC2 static-proof gate refresh,"Updated Invoke-EC2LaneStaticProof.ps1 to enforce auth/readiness gates before AWS identity checks or EC2 start, validated blocked execute no-start behavior, and refreshed readiness/coordinator evidence so dry-run and blocked files are not treated as real static proof","Plan/Instructions/Operations/Scripts/Invoke-EC2LaneStaticProof.ps1; Plan/Instructions/Operations/Scripts/Test-LaneRuntimeReadiness.ps1; Plan/Instructions/Operations/Scripts/Invoke-EC2WorkflowSmokeRun.ps1; Plan/Instructions/QA/Evidence/Workflow_Static_Validation/W61_EC2_LANE_STATIC_PROOF_DRY_RUN_GATED_20260706T034448-0500.json; Plan/Instructions/QA/Evidence/Workflow_Static_Validation/W61_EC2_LANE_STATIC_PROOF_BLOCKED_EXECUTE_20260706T034448-0500.json; Plan/Instructions/QA/Evidence/Runtime_Readiness/W61_LANE_RUNTIME_READINESS_20260706T034515-0500.json; Plan/Instructions/QA/Evidence/Workflow_Runtime/W61_EC2_WORKFLOW_SMOKE_RUN_DRY_RUN_20260706T034516-0500.json; Plan/Instructions/QA/Evidence/Done_Certifications/CERT_W61_EC2_STATIC_PROOF_GATE_REFRESH_20260706T034516-0500.md","PowerShell parser; gated static-proof dry-run; blocked execute expected exit 2; readiness rerun; coordinator dry-run; JSON parse pending final validation",GATED_NO_START_NO_GENERATION,Plan/Instructions/QA/Evidence/Workflow_Static_Validation/W61_EC2_LANE_STATIC_PROOF_BLOCKED_EXECUTE_20260706T034448-0500.json,Refresh AWS auth then rerun auth gate readiness and EC2 static proof
2026-07-06T03:51:48-05:00,60/61,Current operations helper static validation,"Added Test-OperationsHelperStatic.ps1 and validated the current operations helper set after the new EC2 static-proof and smoke-run coordinator changes: 14 scripts parsed, 5 JSON schemas/templates parsed, and 6 local-only smoke checks passed without AWS/Civitai/GitHub/EC2 runtime actions","Plan/Instructions/Operations/Scripts/Test-OperationsHelperStatic.ps1; Plan/Instructions/QA/Evidence/Operations_Static_Validation/W60_OPERATIONS_HELPER_CURRENT_VALIDATION_20260706T035148-0500.json; Plan/Instructions/QA/Evidence/Done_Certifications/CERT_W60_OPERATIONS_HELPER_CURRENT_VALIDATION_20260706T035148-0500.md","PowerShell parser; JSON parse; local-only dry-run smoke tests; latest evidence JSON checks",PASS_LOCAL_ONLY,Plan/Instructions/QA/Evidence/Operations_Static_Validation/W60_OPERATIONS_HELPER_CURRENT_VALIDATION_20260706T035148-0500.json,Refresh AWS auth then rerun auth gate readiness and EC2 static proof
2026-07-06T03:59:00-05:00,59/60,Git current state recheck,"Confirmed C:\Comfy_UI_Main already has .git, canonical origin, ignored/untracked .env, GitHub/Civitai secret variable names present without values printed, and local main matching origin/main","Plan/Instructions/QA/Evidence/Git_Verification/W59_W60_GIT_CURRENT_RECHECK_20260706T035900-0500.json; Plan/Instructions/QA/Evidence/Done_Certifications/CERT_W59_W60_GIT_CURRENT_RECHECK_20260706T035900-0500.md","git status; git rev-parse; git ls-remote; git check-ignore; git ls-files --error-unmatch .env; .env variable-name-only inspection",PASS_CONFIRMED_RESOLVED,Plan/Instructions/QA/Evidence/Git_Verification/W59_W60_GIT_CURRENT_RECHECK_20260706T035900-0500.json,Refresh AWS auth then rerun auth gate readiness and EC2 static proof
2026-07-06T04:02:05-05:00,60/61,Operations helper evidence temp-path redaction,"Updated Test-OperationsHelperStatic.ps1 to redact validation temp paths, regenerated current operations helper validation, and confirmed all 14 scripts, 5 JSON schema/template files, and 6 local smoke checks pass","Plan/Instructions/Operations/Scripts/Test-OperationsHelperStatic.ps1; Plan/Instructions/QA/Evidence/Operations_Static_Validation/W60_OPERATIONS_HELPER_CURRENT_VALIDATION_20260706T040205-0500.json; Plan/Instructions/QA/Evidence/Done_Certifications/CERT_W60_OPERATIONS_HELPER_CURRENT_VALIDATION_SANITIZED_20260706T040205-0500.md","PowerShell parser; Test-OperationsHelperStatic.ps1; ConvertFrom-Json; raw user temp path scan",PASS_LOCAL_ONLY,Plan/Instructions/QA/Evidence/Operations_Static_Validation/W60_OPERATIONS_HELPER_CURRENT_VALIDATION_20260706T040205-0500.json,Refresh AWS auth then rerun auth gate readiness and EC2 static proof
2026-07-06T04:05:05-05:00,60,GitHub checkpoint secret scan hardening,"Added staged content secret scanning to Invoke-GitHubCheckpoint.ps1, added a non-mutating checkpoint dry-run to current operations helper validation, and confirmed 14 scripts, 5 JSON schema/template files, and 7 local smoke checks pass","Plan/Instructions/Operations/Scripts/Invoke-GitHubCheckpoint.ps1; Plan/Instructions/Operations/Scripts/Test-OperationsHelperStatic.ps1; Plan/Instructions/QA/Evidence/Git_Verification/W60_GITHUB_CHECKPOINT_SECRET_SCAN_HARDENING_20260706T040505-0500.json; Plan/Instructions/QA/Evidence/Operations_Static_Validation/W60_OPERATIONS_HELPER_CURRENT_VALIDATION_20260706T040505-0500.json","PowerShell parser; Invoke-GitHubCheckpoint.ps1 dry-run; Test-OperationsHelperStatic.ps1; ConvertFrom-Json; staged secret scan during checkpoint commit",PASS_LOCAL_ONLY,Plan/Instructions/QA/Evidence/Git_Verification/W60_GITHUB_CHECKPOINT_SECRET_SCAN_HARDENING_20260706T040505-0500.json,Refresh AWS auth then rerun auth gate readiness and EC2 static proof
