"Timestamp","Wave","Task","Action","Files_Changed","Validation_Run","Result","Evidence_Path","Next_Action"
"2026-07-07T10:55:00-05:00","69","Mask Factory inpaint no-mouth v4 contract and quality score passed","Implemented a local Wave13 Mask Factory evidence loop for the existing inpaint no-mouth v4 prepared mask. Updated the compiler so explicit person instances and mask layers can pass through from request to contract, added a reusable mask runtime evidence helper, compiled and validated a deterministic contract, generated runtime-style mask evidence from the real PNG, created a workflow patch-manifest row, and scored the mask evidence. The mask is 768x768, SHA256 9bfbbda24b0f4915282649bb8c2b3e5a39b5a057dacbce6278683e9b531ec92d, has 2.8907% coverage, is owned by person_001 for body region face_skin_detail_nomouth, and scored 98.88 against minimum 85 with zero blockers. No ComfyUI generation, EC2, AWS, Civitai, GitHub checkpointing, Wave65 refresh, broad validator, or helper evidence loop occurred.","Plan/07_IMPLEMENTATION/scripts/compile_mask_factory_contract.py; Plan/Instructions/QA/Scripts/New-MaskRuntimeEvidence.ps1; runtime_artifacts/mask_factory/inpaint_nomouth_v4_w69/MASK_FACTORY_REQUEST.json; runtime_artifacts/mask_factory/inpaint_nomouth_v4_w69/MASK_FACTORY_CONTRACT.json; runtime_artifacts/mask_factory/inpaint_nomouth_v4_w69/MASK_FACTORY_CONTRACT_VALIDATION.json; runtime_artifacts/mask_factory/inpaint_nomouth_v4_w69/MASK_RUNTIME_EVIDENCE.json; runtime_artifacts/mask_factory/inpaint_nomouth_v4_w69/MASK_QUALITY_REPORT.json; runtime_artifacts/mask_factory/inpaint_nomouth_v4_w69/MASK_TO_WORKFLOW_PATCH_MANIFEST.csv; Plan/Instructions/QA/Evidence/Mask_Factory/W69_LOCAL_MASK_FACTORY_INPAINT_NOMOUTH_V4_20260707T105500-0500.json; Plan/Tracker/Evidence/W69_LOCAL_MASK_FACTORY_INPAINT_NOMOUTH_V4_20260707T105500-0500.json","Python py_compile; compile_mask_factory_contract.py; validate_mask_factory_contract.py; New-MaskRuntimeEvidence.ps1; score_mask_evidence.py; JSON parse/no-BOM checks; contract validation; mask quality score validation; patch manifest validation; port-closed check","PASS_LOCAL_MASK_FACTORY_INPAINT_NOMOUTH_V4_CONTRACT_AND_QUALITY_SCORE","Plan/Instructions/QA/Evidence/Mask_Factory/W69_LOCAL_MASK_FACTORY_INPAINT_NOMOUTH_V4_20260707T105500-0500.json","Continue local-first with another named implementation/QA gap; do not treat one-mask local Mask Factory evidence as multi-character mask proof, target-runtime proof, or final certification"
"2026-07-07T10:50:00-05:00","69","Canny seed 711570105 seam-suppression local rerun improved","Created one QA-driven Canny seam-suppression profile after multisample QA noted a faint right-edge vertical seam in seed 711570105. The profile kept the same seed, added continuous-background and no-right-edge-seam terms, lowered Canny strength from 0.45 to 0.42, and shortened end percent from 0.65 to 0.60. Built the local run package, executed one bounded local ComfyUI generation, pulled back the diagnostic and generated portrait, and completed strict whole-image visual QA. The prior right-edge dotted seam is no longer visible; eyes, jaw/neck/blazer boundaries, and Canny leakage checks pass with notes. No EC2, AWS, Civitai, GitHub checkpointing, Wave65 refresh, broad validator, or helper evidence loop occurred.","PromptProfiles/base_generation/controlnet_canny_w69_quality_matrix/canny_w69_eyeonly_seam_suppression_seed711570105.json; runtime_artifacts/run_packages/canny_w69_eyeonly_seam_suppression_711570105/RUN_PACKAGE_MANIFEST.json; Plan/Instructions/QA/Evidence/Workflow_Runtime/W69_LOCAL_CANNY_EYEONLY_SEAM_SUPPRESSION_SEED711570105_EXECUTE_20260707T104800-0500.json; Plan/Instructions/Operations/Pulled_Back_Artifacts/canny_w69_eyeonly_seam_suppression_711570105_20260707T104736-0500/images/canny_w69_eyeonly_seam_suppression_711570105_00001_.png; Plan/Instructions/QA/Evidence/Image_Artifact_QA/W69_LOCAL_CANNY_EYEONLY_SEAM_SUPPRESSION_VISUAL_QA_20260707T105000-0500.json; Plan/Tracker/Evidence/W69_LOCAL_CANNY_EYEONLY_SEAM_SUPPRESSION_20260707T105000-0500.json","New-WorkflowRunPackage.ps1; Invoke-LocalComfyUIRunPackageSmoke.ps1 -Execute; direct image inspection; strict whole-image visual QA; hash/dimension checks; port-closed check","PASS_WITH_NOTES_LOCAL_CANNY_SEAM_SUPPRESSION_IMPROVED","Plan/Instructions/QA/Evidence/Image_Artifact_QA/W69_LOCAL_CANNY_EYEONLY_SEAM_SUPPRESSION_VISUAL_QA_20260707T105000-0500.json","Do not rerun the same Canny sample without new QA input; preferred local Canny candidate remains seed 711570102 and final MOD-17 still requires target-runtime proof"
"2026-07-07T10:45:00-05:00","69","LoRA activation geometry gate passed","Implemented a local static LoRA activation safety validator for Priority 3. The gate scanned the active lane manifest, active workflow API files, mirrored Plan templates, patch points, the Wave 04 LoRA catalog inventory, and the Wave 15 compatibility matrix. It scanned 8 active lanes and 16 workflow files, found zero active LoRA loader/library nodes, confirmed all 274 LoRA catalog entries are disabled by default, and reported zero blocking defects. Three historical source-canvas ACTIVE_COPY labels are recorded as a warning only because they are disabled by default and absent from active extracted workflows. No ComfyUI generation, EC2, AWS, Civitai, GitHub checkpointing, Wave65 refresh, broad validator, or helper evidence loop occurred.","Plan/Instructions/QA/Scripts/Test-LoraActivationSafety.ps1; Plan/Instructions/QA/Evidence/Workflow_Static_Validation/W69_LOCAL_LORA_ACTIVATION_SAFETY_20260707T104500-0500.json; Plan/Tracker/Evidence/W69_LOCAL_LORA_ACTIVATION_SAFETY_20260707T104500-0500.json","PowerShell parser validation; LoRA activation safety script execution; active workflow JSON parse; mirrored workflow JSON parse; LoRA catalog JSON parse; compatibility matrix JSON parse; JSON no-BOM checks; port-closed check; git diff --check","PASS_LOCAL_LORA_ACTIVATION_SAFETY","Plan/Instructions/QA/Evidence/Workflow_Static_Validation/W69_LOCAL_LORA_ACTIVATION_SAFETY_20260707T104500-0500.json","Continue local-first with another named implementation/QA gap; do not treat static LoRA safety as LoRA runtime activation proof or final certification"
"2026-07-07T10:35:00-05:00","69","QA supersession gate corrected historical blocker accounting","Updated the QA sheet exporter to accept a supersession map, added a structured supersession map for the two historical failed local QA rows, regenerated the image QA sheet and promotion gate, and regenerated the orchestrator promotion manifest from the corrected gate. The corrected gate exported 47 rows, parsed with zero errors, marked 2 historical failed rows as superseded, reduced current blocking_row_count from 2 to 0, and still blocks final promotion for 45 target-runtime blocks. No ComfyUI generation, EC2, AWS, Civitai, GitHub checkpointing, Wave65 refresh, broad validator, or helper evidence loop occurred.","Plan/Instructions/QA/Scripts/Export-QAEvidenceSheet.ps1; Plan/Instructions/QA/Evidence/QA_Sheets/W69_LOCAL_IMAGE_QA_SUPERSESSION_MAP_20260707T103500-0500.json; Plan/Instructions/QA/Evidence/QA_Sheets/W69_LOCAL_IMAGE_QA_SHEET_SUPERSEDED_20260707T103500-0500.csv; Plan/Instructions/QA/Evidence/QA_Sheets/W69_LOCAL_IMAGE_QA_PROMOTION_GATE_SUPERSEDED_20260707T103500-0500.json; Plan/07_IMPLEMENTATION/manifests/generated/W69_LOCAL_IMAGE_QA_ORCHESTRATOR_PROMOTION_MANIFEST_SUPERSEDED_20260707T103500-0500.json; Plan/Tracker/Evidence/W69_LOCAL_QA_SUPERSESSION_GATE_20260707T103500-0500.json","PowerShell parser validation; supersession map JSON parse/no-BOM; promotion gate JSON parse/no-BOM; tracker JSON parse/no-BOM; CSV row/supersession validation; gate field validation; port-closed check","PASS_LOCAL_QA_SUPERSESSION_GATE_BLOCKS_ONLY_TARGET_RUNTIME","Plan/Instructions/QA/Evidence/QA_Sheets/W69_LOCAL_IMAGE_QA_PROMOTION_GATE_SUPERSEDED_20260707T103500-0500.json","Continue local-first with a named implementation/QA gap or intentionally select one bounded target-runtime proof when appropriate; do not treat supersession accounting as final certification"
"2026-07-07T10:25:00-05:00","69","Orchestrator promotion manifest builder added","Implemented a local Wave 14 promotion-manifest helper that consumes QA promotion gate evidence and writes a concrete orchestrator promotion manifest. The generated manifest consumed the W69 local image QA promotion gate, recorded two passed local QA aggregation passes, two failed/blocking QA rows, zero promoted outputs, and four blocking reasons, and correctly blocked final promotion for missing target-runtime proof. No ComfyUI execution, EC2, AWS, Civitai, GitHub checkpointing, Wave65 refresh, broad validator, or helper evidence loop occurred.","Plan/Instructions/QA/Scripts/New-OrchestratorPromotionManifest.ps1; Plan/Instructions/QA/Evidence/QA_Sheets/W69_LOCAL_IMAGE_QA_PROMOTION_GATE_20260707T101500-0500.json; Plan/07_IMPLEMENTATION/manifests/generated/W69_LOCAL_IMAGE_QA_ORCHESTRATOR_PROMOTION_MANIFEST_20260707T102500-0500.json; Plan/Tracker/Evidence/W69_LOCAL_ORCHESTRATOR_PROMOTION_MANIFEST_20260707T102500-0500.json","PowerShell parser validation; New-OrchestratorPromotionManifest.ps1; promotion manifest JSON parse; no-BOM JSON check; manifest field checks; port-closed check; git diff --check","PASS_LOCAL_ORCHESTRATOR_PROMOTION_MANIFEST_BLOCKS_FINAL","Plan/07_IMPLEMENTATION/manifests/generated/W69_LOCAL_IMAGE_QA_ORCHESTRATOR_PROMOTION_MANIFEST_20260707T102500-0500.json","Prefer another named local gap next; do not treat the promotion manifest as final certification"
"2026-07-07T10:15:00-05:00","69","QA sheet exporter and promotion gate added","Implemented Priority 5 local QA tooling by adding Export-QAEvidenceSheet.ps1. The script scans structured image QA JSON evidence, exports a compact CSV review sheet, and writes a machine-readable promotion-gate JSON. The corrected run scanned W69_LOCAL_*.json image-QA evidence, exported 47 rows with zero blank result rows, and correctly blocked final promotion because target-runtime proof was required and all scanned rows are local-only; two historical rows remain failed/blocking. No ComfyUI execution, EC2, AWS, Civitai, GitHub checkpointing, Wave65 refresh, broad validator, or helper evidence loop occurred.","Plan/Instructions/QA/Scripts/Export-QAEvidenceSheet.ps1; Plan/Instructions/QA/Evidence/QA_Sheets/W69_LOCAL_IMAGE_QA_SHEET_20260707T101500-0500.csv; Plan/Instructions/QA/Evidence/QA_Sheets/W69_LOCAL_IMAGE_QA_PROMOTION_GATE_20260707T101500-0500.json; Plan/Tracker/Evidence/W69_LOCAL_QA_SHEET_EXPORT_PROMOTION_GATE_20260707T101500-0500.json","PowerShell parser validation; Export-QAEvidenceSheet.ps1 -RequireTargetRuntimeForPromotion; CSV row/result validation; promotion gate JSON parse; no-BOM JSON check; git diff --check","PASS_LOCAL_QA_SHEET_EXPORT_PROMOTION_GATE_BLOCKS_FINAL","Plan/Instructions/QA/Evidence/QA_Sheets/W69_LOCAL_IMAGE_QA_PROMOTION_GATE_20260707T101500-0500.json","Prefer another named local gap next; do not treat QA sheet export as final certification"
"2026-07-07T09:50:00-05:00","69","RealVisXL single-hand contact close-up passed with notes","Created one QA-driven RealVisXL base-lane profile after portrait-plus-hand prompts repeatedly drifted into clasped or overlapping hands. The profile changed the target to an isolated single right hand resting on a wooden tabletop, built a local run package, executed one bounded low-VRAM local ComfyUI generation, pulled back the 1024x1024 image, and completed strict whole-image visual QA. The sample shows one visible hand, five readable fingers, natural spacing, plausible nails/knuckles/wrist anatomy, clean cuff edge, tabletop contact, and contact shadows. No EC2, AWS, Civitai, GitHub checkpointing, Wave65 refresh, broad validator, or helper evidence loop occurred.","PromptProfiles/base_generation/realvisxl_multisample_certification/realvisxl_single_hand_contact_closeup_v1.json; runtime_artifacts/run_packages/realvisxl_single_hand_contact_closeup_w69_v1/RUN_PACKAGE_MANIFEST.json; Plan/Instructions/QA/Evidence/Workflow_Runtime/W69_LOCAL_REALVISXL_SINGLE_HAND_CONTACT_CLOSEUP_V1_EXECUTE_20260707T094700-0500.json; Plan/Instructions/Operations/Pulled_Back_Artifacts/realvisxl_single_hand_contact_closeup_w69_v1_20260707T094626-0500/images/codex_realvisxl_single_hand_contact_closeup_00001_.png; Plan/Instructions/QA/Evidence/Image_Artifact_QA/W69_LOCAL_REALVISXL_SINGLE_HAND_CONTACT_CLOSEUP_V1_VISUAL_QA_20260707T095000-0500.json; Plan/Tracker/Evidence/W69_LOCAL_REALVISXL_SINGLE_HAND_CONTACT_CLOSEUP_20260707T095000-0500.json","New-WorkflowRunPackage.ps1; Invoke-LocalComfyUIRunPackageSmoke.ps1 -LowVram -Execute; direct image inspection; strict whole-image visual QA; hash/dimension checks; port-closed check","PASS_WITH_NOTES_LOCAL_REALVISXL_SINGLE_HAND_CONTACT_CLOSEUP","Plan/Instructions/QA/Evidence/Image_Artifact_QA/W69_LOCAL_REALVISXL_SINGLE_HAND_CONTACT_CLOSEUP_V1_VISUAL_QA_20260707T095000-0500.json","Prefer another named local gap next; do not claim portrait-with-hands, two-hand separation, full-body, target-runtime, or final RealVisXL certification from this close-up sample"
"2026-07-07T09:42:00-05:00","69","Lineart v4 plain-backdrop local multiseed robustness passed with notes","Created two seed-only robustness profiles for the preferred Lineart v4 plain-backdrop strategy, built both local run packages, executed two bounded low-VRAM local ComfyUI generations, pulled back diagnostics and portraits, and completed strict multisample whole-image visual QA across preferred seed 711370003 plus robustness seeds 711370005 and 711370006. Plain matte background, clean Lineart guidance, and coherent subject presentation held across all three samples; mild skin polish and exact-identity limits remain notes. No EC2, AWS, Civitai, GitHub checkpointing, Wave65 refresh, broad validator, or helper evidence loop occurred.","PromptProfiles/base_generation/controlnet_lineart_v1_followup/lineart_v4_robust_plain_backdrop_seed711370005.json; PromptProfiles/base_generation/controlnet_lineart_v1_followup/lineart_v4_robust_plain_backdrop_seed711370006.json; runtime_artifacts/run_packages/lineart_v4_robust_plain_711370005/RUN_PACKAGE_MANIFEST.json; runtime_artifacts/run_packages/lineart_v4_robust_plain_711370006/RUN_PACKAGE_MANIFEST.json; Plan/Instructions/QA/Evidence/Workflow_Runtime/W69_LOCAL_LINEART_V4_ROBUST_SEED711370005_EXECUTE_20260707T093700-0500.json; Plan/Instructions/QA/Evidence/Workflow_Runtime/W69_LOCAL_LINEART_V4_ROBUST_SEED711370006_EXECUTE_20260707T093800-0500.json; Plan/Instructions/QA/Evidence/Image_Artifact_QA/W69_LOCAL_LINEART_V4_MULTISEED_ROBUSTNESS_VISUAL_QA_20260707T094200-0500.json; Plan/Tracker/Evidence/W69_LOCAL_LINEART_V4_MULTISEED_ROBUSTNESS_20260707T094200-0500.json","New-WorkflowRunPackage.ps1; Invoke-LocalComfyUIRunPackageSmoke.ps1 -LowVram -Execute; direct image inspection; strict multisample whole-image visual QA; hash/dimension checks; port-closed check","PASS_WITH_NOTES_LOCAL_LINEART_V4_MULTISEED_ROBUSTNESS","Plan/Instructions/QA/Evidence/Image_Artifact_QA/W69_LOCAL_LINEART_V4_MULTISEED_ROBUSTNESS_VISUAL_QA_20260707T094200-0500.json","Prefer another named local gap next; do not claim final Lineart certification without target-runtime proof and final certification review"
"2026-07-07T09:33:00-05:00","69","Lineart v4 plain-backdrop follow-up promoted as preferred local candidate with notes","Created one stronger background-strategy Lineart v4 profile after v3 removed the diagonal strip but retained bright-panel/window-band artifacts. The profile retested seed 711370003 with a plain matte neutral studio backdrop, explicit no-window/no-panel/no-light-bar constraints, and reduced/shortened Lineart ControlNet influence. Built the local run package, executed one bounded low-VRAM local ComfyUI generation, pulled back diagnostic and portrait, and completed strict whole-image visual QA. V4 removed the v3 bright panel and vertical window bands while preserving coherent subject presentation and clean Lineart control. It is preferred local Lineart candidate with notes, not final certification. No EC2, AWS, Civitai, GitHub checkpointing, Wave65 refresh, broad validator, or helper evidence loop occurred.","PromptProfiles/base_generation/controlnet_lineart_v1_followup/lineart_v4_plain_backdrop_seed711370003.json; runtime_artifacts/run_packages/lineart_v4_plain_backdrop_711370003/RUN_PACKAGE_MANIFEST.json; Plan/Instructions/QA/Evidence/Workflow_Runtime/W69_LOCAL_LINEART_V4_PLAIN_BACKDROP_SEED711370003_EXECUTE_20260707T093000-0500.json; Plan/Instructions/Operations/Pulled_Back_Artifacts/lineart_v4_plain_backdrop_711370003_20260707T092845-0500/images/lineart_v4_plain_backdrop_711370003_00001_.png; Plan/Instructions/QA/Evidence/Image_Artifact_QA/W69_LOCAL_LINEART_V4_PLAIN_BACKDROP_VISUAL_QA_20260707T093300-0500.json; Plan/Tracker/Evidence/W69_LOCAL_LINEART_V4_PLAIN_BACKDROP_FOLLOWUP_20260707T093300-0500.json","New-WorkflowRunPackage.ps1; Invoke-LocalComfyUIRunPackageSmoke.ps1 -LowVram -Execute; direct image inspection; strict whole-image visual QA; hash/dimension checks; port-closed check","PASS_WITH_NOTES_PREFERRED_LOCAL_LINEART_V4_CANDIDATE","Plan/Instructions/QA/Evidence/Image_Artifact_QA/W69_LOCAL_LINEART_V4_PLAIN_BACKDROP_VISUAL_QA_20260707T093300-0500.json","If continuing Lineart locally, run seed-only robustness for v4; do not claim final Lineart certification without target-runtime proof and final certification review"
"2026-07-07T09:25:00-05:00","69","Canny eye-only local multiseed robustness passed with notes","Created two seed-only robustness profiles for the preferred Canny eye-only candidate, built both local run packages, executed two bounded low-VRAM local ComfyUI generations, pulled back diagnostics and portraits, and completed strict multisample whole-image visual QA across preferred seed 711570102 plus robustness seeds 711570104 and 711570105. Eye readability, clean Canny guidance, natural edge behavior, and stable jaw/collar boundaries held across all three samples; seed 711570105 has a faint right-edge vertical seam/background artifact. No EC2, AWS, Civitai, GitHub checkpointing, Wave65 refresh, broad validator, or helper evidence loop occurred.","PromptProfiles/base_generation/controlnet_canny_w69_quality_matrix/canny_w69_eyeonly_robust_seed711570104.json; PromptProfiles/base_generation/controlnet_canny_w69_quality_matrix/canny_w69_eyeonly_robust_seed711570105.json; runtime_artifacts/run_packages/canny_w69_eyeonly_robust_711570104/RUN_PACKAGE_MANIFEST.json; runtime_artifacts/run_packages/canny_w69_eyeonly_robust_711570105/RUN_PACKAGE_MANIFEST.json; Plan/Instructions/QA/Evidence/Workflow_Runtime/W69_LOCAL_CANNY_EYEONLY_ROBUST_SEED711570104_EXECUTE_20260707T092200-0500.json; Plan/Instructions/QA/Evidence/Workflow_Runtime/W69_LOCAL_CANNY_EYEONLY_ROBUST_SEED711570105_EXECUTE_20260707T092300-0500.json; Plan/Instructions/QA/Evidence/Image_Artifact_QA/W69_LOCAL_CANNY_EYEONLY_MULTISEED_ROBUSTNESS_VISUAL_QA_20260707T092500-0500.json; Plan/Tracker/Evidence/W69_LOCAL_CANNY_EYEONLY_MULTISEED_ROBUSTNESS_20260707T092500-0500.json","New-WorkflowRunPackage.ps1; Invoke-LocalComfyUIRunPackageSmoke.ps1 -LowVram -Execute; direct image inspection; strict multisample whole-image visual QA; hash/dimension checks; port-closed check","PASS_WITH_NOTES_LOCAL_CANNY_EYEONLY_MULTISEED_ROBUSTNESS","Plan/Instructions/QA/Evidence/Image_Artifact_QA/W69_LOCAL_CANNY_EYEONLY_MULTISEED_ROBUSTNESS_VISUAL_QA_20260707T092500-0500.json","Prefer another named local gap next; do not claim final Canny certification without target-runtime proof and final certification review"
"2026-07-07T09:16:00-05:00","69","Lineart v3 background identity follow-up partially improved local result","Created one QA-driven Lineart v3 profile after v2 multiseed QA found clean control but weak background and subject-presentation robustness. The profile retested seed 711370003 with body-woman professional presentation anchoring, explicit diagonal/window-light negatives, and reduced/shortened Lineart ControlNet influence. Built the local run package, executed one bounded low-VRAM local ComfyUI generation, pulled back diagnostic and portrait, and completed strict whole-image visual QA. V3 removed the previous diagonal light strip and improved subject presentation while preserving clean Lineart control, but a bright upper-left panel and right-side vertical window bands remain, so v3 is partial improvement only and not promoted. No EC2, AWS, Civitai, GitHub checkpointing, Wave65 refresh, broad validator, or helper evidence loop occurred.","PromptProfiles/base_generation/controlnet_lineart_v1_followup/lineart_v3_background_identity_seed711370003.json; runtime_artifacts/run_packages/lineart_v3_background_identity_711370003/RUN_PACKAGE_MANIFEST.json; Plan/Instructions/QA/Evidence/Workflow_Runtime/W69_LOCAL_LINEART_V3_BACKGROUND_IDENTITY_SEED711370003_EXECUTE_20260707T091500-0500.json; Plan/Instructions/Operations/Pulled_Back_Artifacts/lineart_v3_background_identity_711370003_20260707T091312-0500/images/lineart_v3_background_identity_711370003_00001_.png; Plan/Instructions/QA/Evidence/Image_Artifact_QA/W69_LOCAL_LINEART_V3_BACKGROUND_IDENTITY_VISUAL_QA_20260707T091600-0500.json; Plan/Tracker/Evidence/W69_LOCAL_LINEART_V3_BACKGROUND_IDENTITY_FOLLOWUP_20260707T091600-0500.json","New-WorkflowRunPackage.ps1; Invoke-LocalComfyUIRunPackageSmoke.ps1 -LowVram -Execute; direct image inspection; strict whole-image visual QA; hash/dimension checks; port-closed check","PARTIAL_IMPROVEMENT_LINEART_V3_NOT_PROMOTED","Plan/Instructions/QA/Evidence/Image_Artifact_QA/W69_LOCAL_LINEART_V3_BACKGROUND_IDENTITY_VISUAL_QA_20260707T091600-0500.json","Prefer another named local gap next; if continuing Lineart use stronger background strategy or different control composition rather than prompt-only repeats"
"2026-07-07T08:30:00-05:00","69","Lineart v2 local multiseed robustness functional pass with notes","Created two seed-only robustness profiles for the preferred Lineart v2 natural-skin/background strategy, built both local run packages, executed two bounded low-VRAM local ComfyUI generations, pulled back diagnostics and portraits, and completed strict multisample whole-image visual QA across preferred seed 711370002 plus robustness seeds 711370003 and 711370004. Lineart control cleanliness held with no visible ink outlines, contour stains, or lineart leakage; background and identity robustness were weaker because seed 711370003 has a strong diagonal light strip and seed 711370004 changes subject presentation while retaining vertical window bands. No EC2, AWS, Civitai, GitHub checkpointing, Wave65 refresh, broad validator, or helper evidence loop occurred.","PromptProfiles/base_generation/controlnet_lineart_v1_followup/lineart_v2_robust_natural_skin_seed711370003.json; PromptProfiles/base_generation/controlnet_lineart_v1_followup/lineart_v2_robust_natural_skin_seed711370004.json; runtime_artifacts/run_packages/lineart_v2_robust_711370003/RUN_PACKAGE_MANIFEST.json; runtime_artifacts/run_packages/lineart_v2_robust_711370004/RUN_PACKAGE_MANIFEST.json; Plan/Instructions/QA/Evidence/Workflow_Runtime/W69_LOCAL_LINEART_V2_ROBUST_SEED711370003_EXECUTE_20260707T082300-0500.json; Plan/Instructions/QA/Evidence/Workflow_Runtime/W69_LOCAL_LINEART_V2_ROBUST_SEED711370004_EXECUTE_20260707T082500-0500.json; Plan/Instructions/QA/Evidence/Image_Artifact_QA/W69_LOCAL_LINEART_V2_MULTISEED_ROBUSTNESS_VISUAL_QA_20260707T083000-0500.json; Plan/Tracker/Evidence/W69_LOCAL_LINEART_V2_MULTISEED_ROBUSTNESS_20260707T083000-0500.json","New-WorkflowRunPackage.ps1; Invoke-LocalComfyUIRunPackageSmoke.ps1 -LowVram -Execute; direct image inspection; strict multisample whole-image visual QA; hash/dimension checks; port-closed check","PASS_WITH_NOTES_LOCAL_LINEART_V2_FUNCTIONAL_BACKGROUND_IDENTITY_WEAKER","Plan/Instructions/QA/Evidence/Image_Artifact_QA/W69_LOCAL_LINEART_V2_MULTISEED_ROBUSTNESS_VISUAL_QA_20260707T083000-0500.json","Prefer another named local gap next; do not claim final Lineart certification without target-runtime proof, stronger background/identity robustness, and final certification review"
