"Timestamp","Wave","Task","Action","Files_Changed","Validation_Run","Result","Evidence_Path","Next_Action"
"2026-07-10T16:03:05-05:00","66","Local ComfyUI model-readiness fail-closed hardening","Made missing, malformed, empty, invalid-contract, absent-model, and hash-mismatch runtime requirements fail closed; added eight disposable model-placement/hash cases and corrected runnable GPU-candidate exit semantics","tools/Test-LocalComfyUIDevPreflight.ps1; Plan/Instructions/QA/Scripts/Test-LocalComfyUIDevPreflightRegression.ps1; Plan/Instructions/Operations/Scripts/Test-OperationsHelperStatic.ps1; Plan/Instructions/QA/Evidence/Operations_Static_Validation/W66_LOCAL_COMFYUI_DEV_PREFLIGHT_MODEL_REQUIREMENTS_REGRESSION_20260710T144600-0500.json; Plan/Instructions/QA/Evidence/Runtime_Readiness/W66_LOCAL_COMFYUI_DEV_PREFLIGHT_REQUIRE_RUNNABLE_CURRENT_20260710T144600-0500.json","Eight of eight requirement/model-placement/hash cases pass; operations harness 46 scripts and 30 smokes with zero failures; actual low-risk lane reports pass_local_gpu_generation_candidate with CUDA, model hash match, and static pass while generation_executed=false","PASS_LOCAL_ONLY_LOCAL_COMFYUI_MODEL_REQUIREMENTS_FAIL_CLOSED","Plan/Instructions/QA/Evidence/Operations_Static_Validation/W66_LOCAL_COMFYUI_DEV_PREFLIGHT_MODEL_REQUIREMENTS_REGRESSION_20260710T144600-0500.json","Keep EC2 stopped; use local GPU only for intentionally selected unfinished non-mask iteration with separate generated-artifact QA"
"2026-07-10T14:28:34-05:00","66","Root project preflight fail-closed hardening","Made non-Git, unavailable-status, and empty-lane states write structured failures; added an eight-case disposable Git-fixture regression and shared parser-harness coverage","tools/Test-RootProjectPreflight.ps1; Plan/Instructions/QA/Scripts/Test-RootProjectPreflightRegression.ps1; Plan/Instructions/Operations/Scripts/Test-OperationsHelperStatic.ps1; Plan/Instructions/QA/Evidence/Operations_Static_Validation/W66_ROOT_PROJECT_PREFLIGHT_FAIL_CLOSED_REGRESSION_20260710T142800-0500.json","Eight of eight fixture cases pass; operations harness parses 44 scripts and runs 30 local smokes plus 10 evidence and 10 evidence-contract checks with zero failures; QA and Tracker mirrors match","PASS_LOCAL_ONLY_ROOT_PROJECT_PREFLIGHT_FAIL_CLOSED_REGRESSION","Plan/Instructions/QA/Evidence/Operations_Static_Validation/W66_ROOT_PROJECT_PREFLIGHT_FAIL_CLOSED_REGRESSION_20260710T142800-0500.json","Keep EC2 stopped; checkpoint the actual repository; do not close the global work order from fixture evidence alone"
"2026-07-10T13:46:46-05:00","66","RealESRGAN package/deploy publish-evidence hardening","Made supplied missing, invalid-JSON, and non-object publish evidence produce structured fail-closed records; added a reusable six-case regression and parser-harness coverage","Plan/Instructions/QA/Scripts/Test-RunPackageDeployBundleConsistency.ps1; Plan/Instructions/QA/Scripts/Test-RunPackageDeployBundleConsistencyRegression.ps1; Plan/Instructions/Operations/Scripts/Test-OperationsHelperStatic.ps1; Plan/Instructions/QA/Evidence/Operations_Static_Validation/W66_REALESRGAN_PACKAGE_DEPLOY_PUBLISH_EVIDENCE_STRICT_REGRESSION_20260710T134600-0500.json","Six of six strict publish cases pass; operations harness parses 42 scripts and runs 30 local smokes plus 10 evidence and 10 evidence-contract checks with zero failures; QA and Tracker mirrors match","PASS_LOCAL_ONLY_REALESRGAN_PUBLISH_EVIDENCE_STRICT_REGRESSION","Plan/Instructions/QA/Evidence/Operations_Static_Validation/W66_REALESRGAN_PACKAGE_DEPLOY_PUBLISH_EVIDENCE_STRICT_REGRESSION_20260710T134600-0500.json","Keep EC2 stopped; target-runtime work order remains open; continue another concrete non-mask local implementation task without regenerating this evidence"
"2026-07-10T13:18:52-05:00","65/66/69","Canonical OpenPose tabletop-hands source closure","Implemented ITEM-W65-0209/TRK-W65-0209 intended next use by making the tabletop-hands map canonical across workflow/runtime/smoke mirrors and rebuilding the affected local package, deploy, transfer, and handoff chain","Workflows/base_generation/sdxl_realvisxl_controlnet_openpose_lane; Plan/07_IMPLEMENTATION/workflow_templates/base_generation/sdxl_realvisxl_controlnet_openpose_lane; Plan/Instructions/QA/Evidence/Wave65/ITEM-W65-0209.json; Plan/Instructions/QA/Evidence/Runtime_Readiness/W66_CONTROLNET_FOUR_LANE_PRE_EC2_HANDOFF_MATRIX_TABLEHANDS_CANONICAL_20260710T133400-0500.json","Three source assets hash/size pass; three mirror pairs match; run package static/smoke pass; package 10/10; asset transfer 16/16 with six children; four-lane handoffs 4/4; existing whole-image robustness pass with notes","PASS_SOURCE_REQUIREMENTS_IMPLEMENTED_TESTED_REVIEWED_EVIDENCED","Plan/Instructions/QA/Evidence/Wave65/ITEM-W65-0209.json","Keep EC2 stopped; source row complete only; OpenPose target-runtime proof and final hand certification remain live-gated"
"2026-07-10T12:49:30-05:00","66","Four-lane ControlNet pre-EC2 handoff matrix","Added a strict one-lane handoff validator; linked package/deploy, deploy publish dry run, asset-transfer bundle, and exact clean Git authority for all four ControlNet lanes","Plan/Instructions/QA/Scripts/New-ControlNetLanePreEC2HandoffBundle.ps1; Plan/Instructions/QA/Evidence/Runtime_Readiness/W66_CONTROLNET_FOUR_LANE_PRE_EC2_HANDOFF_MATRIX_20260710T130500-0500.json; Plan/Tracker/Evidence/Runtime_Readiness/W66_CONTROLNET_FOUR_LANE_PRE_EC2_HANDOFF_MATRIX_20260710T130500-0500.json","Four of four lanes pass seven checks at Git 054e278; four deploy URIs, one shared checkpoint URI, four ControlNet/input URIs; five corrupted-contract tests fail closed; all live and certification flags false","PASS_LOCAL_ONLY_CONTROLNET_FOUR_LANE_PRE_EC2_HANDOFFS_READY_LIVE_BLOCKED","Plan/Instructions/QA/Evidence/Runtime_Readiness/W66_CONTROLNET_FOUR_LANE_PRE_EC2_HANDOFF_MATRIX_20260710T130500-0500.json","Freeze local ControlNet readiness; require explicit live-window selection for execution or move to another unfinished non-mask local task"
"2026-07-10T12:38:40-05:00","66","Four-lane ControlNet asset-transfer dry-run matrix","Added a reusable selected-lane transfer helper; verified checkpoint, ControlNet, control image, and source-artifact hashes; generated 24 publish/install dry-run children across four lanes","Plan/Instructions/QA/Scripts/Test-ControlNetLaneAssetTransferDryRunBundle.ps1; Plan/Instructions/QA/Evidence/Runtime_Readiness/W66_CONTROLNET_FOUR_LANE_ASSET_TRANSFER_DRY_RUN_MATRIX_20260710T124500-0500.json; Plan/Tracker/Evidence/Runtime_Readiness/W66_CONTROLNET_FOUR_LANE_ASSET_TRANSFER_DRY_RUN_MATRIX_20260710T124500-0500.json","Four of four lanes pass 16 checks each; 24 children present; one shared checkpoint URI/hash; four unique ControlNet and input URIs; five negative tests create zero children; operations harness 40 scripts and 30 smokes with zero failures","PASS_LOCAL_ONLY_CONTROLNET_FOUR_LANE_ASSET_TRANSFER_MATRIX","Plan/Instructions/QA/Evidence/Runtime_Readiness/W66_CONTROLNET_FOUR_LANE_ASSET_TRANSFER_DRY_RUN_MATRIX_20260710T124500-0500.json","Keep EC2 stopped; create deploy-bundle publish dry-run linkage and a four-lane pre-EC2 handoff matrix without Execute"
"2026-07-10T12:16:17-05:00","66","Four-lane ControlNet current package/deploy matrix","Built fresh lineart/openpose/normal packages and clean deploy bundles; corrected canonical normal_bae handling; reran depth and fail-closed regression against the current validator","Plan/Instructions/QA/Scripts/Test-ControlNetSelectedLanePackageDeployConsistency.ps1; Plan/Instructions/QA/Evidence/Operations_Static_Validation/W66_CONTROLNET_FOUR_LANE_CURRENT_PACKAGE_DEPLOY_MATRIX_20260710T121800-0500.json; Plan/Tracker/Evidence/Operations_Static_Validation/W66_CONTROLNET_FOUR_LANE_CURRENT_PACKAGE_DEPLOY_MATRIX_20260710T121800-0500.json","Four of four lanes pass 10/10; all packages have zero source drift; all bundles record clean Git; four negative tests pass; operations harness 39 scripts and 30 smokes with zero failures","PASS_LOCAL_ONLY_CONTROLNET_FOUR_LANE_PACKAGE_DEPLOY_MATRIX","Plan/Instructions/QA/Evidence/Operations_Static_Validation/W66_CONTROLNET_FOUR_LANE_CURRENT_PACKAGE_DEPLOY_MATRIX_20260710T121800-0500.json","Keep EC2 stopped; prepare model/control-image publish and install dry-run contracts without Execute before any explicitly selected live proof"
"2026-07-10T12:10:17-05:00","66","ControlNet selected-lane package/deploy validator and depth clean package proof","Added a reusable composed ControlNet validator; built current depth run package and clean deploy bundle; validated positive and four fail-closed cases without external contact","Plan/Instructions/QA/Scripts/Test-ControlNetSelectedLanePackageDeployConsistency.ps1; Plan/Instructions/Operations/Scripts/Test-OperationsHelperStatic.ps1; Plan/Instructions/QA/Evidence/Operations_Static_Validation/W66_CONTROLNET_DEPTH_CURRENT_PACKAGE_DEPLOY_CONSISTENCY_20260710T120600-0500.json; Plan/Instructions/QA/Evidence/Operations_Static_Validation/W66_CONTROLNET_SELECTED_LANE_PACKAGE_DEPLOY_VALIDATOR_REGRESSION_20260710T120900-0500.json","Depth positive 10/10; generic validator 0 failures; unsupported lane, lane mismatch, wrong control map, and broken smoke binding fail with expected categories; operations harness 39 scripts and 30 smokes with zero failures","PASS_LOCAL_ONLY_CONTROLNET_DEPTH_PACKAGE_DEPLOY_CONTRACT","Plan/Instructions/QA/Evidence/Operations_Static_Validation/W66_CONTROLNET_SELECTED_LANE_PACKAGE_DEPLOY_VALIDATOR_REGRESSION_20260710T120900-0500.json","Keep EC2 stopped; validate current clean lineart/openpose/normal packages locally or require explicit live-window selection before any target-runtime action"
"2026-07-10T11:46:52-05:00","66","RealESRGAN current package and clean deploy-bundle consistency","Detected stale embedded lane requirements before upload; rebuilt the run package and clean deploy bundle; added a generic consistency validator; generated S3 publish dry run only","Plan/Instructions/QA/Scripts/Test-RunPackageDeployBundleConsistency.ps1; Plan/Instructions/Operations/Scripts/Test-OperationsHelperStatic.ps1; Plan/Instructions/QA/Evidence/Operations_Static_Validation/W66_REALESRGAN_CURRENT_RUN_PACKAGE_DEPLOY_BUNDLE_CONSISTENCY_20260710T114200-0500.json; Plan/Instructions/QA/Evidence/Operations_Static_Validation/W66_REALESRGAN_STALE_RUN_PACKAGE_NEGATIVE_20260710T114300-0500.json; Plan/Instructions/QA/Evidence/Runtime_Readiness/W66_REALESRGAN_DEPLOY_BUNDLE_S3_PUBLISH_DRY_RUN_CURRENT_20260710T114100-0500.json","Current pair passes 40 checks; stale pair exits 1 with stale_clean_git_metadata; full operations harness passes with 38 scripts, 30 smokes, and zero failures","PASS_LOCAL_ONLY_REALESRGAN_CURRENT_CLEAN_DEPLOY_CHAIN","Plan/Instructions/QA/Evidence/Operations_Static_Validation/W66_REALESRGAN_CURRENT_RUN_PACKAGE_DEPLOY_BUNDLE_CONSISTENCY_20260710T114200-0500.json","Keep EC2 stopped; require explicit live intent before S3 Execute, EC2 install/static proof, bounded generation, pullback, strict visual QA, or certification"
"2026-07-10T11:36:07-05:00","66","RealESRGAN target-runtime asset-transfer dry-run bundle","Added one lane-scoped bundle that hash-validates the local model/input and combines model/input S3 publish dry-runs with model/input EC2 install plans; no external or mask action occurred","Plan/Instructions/QA/Scripts/Test-RealesrganLaneAssetTransferDryRunBundle.ps1; Plan/Instructions/QA/Evidence/Runtime_Readiness/W66_SDXL_REALESRGAN_UPSCALE_ASSET_TRANSFER_DRY_RUN_BUNDLE_20260710T113605-0500.json; Plan/Tracker/Evidence/Runtime_Readiness/W66_SDXL_REALESRGAN_UPSCALE_ASSET_TRANSFER_DRY_RUN_BUNDLE_20260710T113605-0500.json","Parser pass; positive result pass with child_artifact_count=4 and failed_check_count=0; invalid URI/model hash/input hash/Execute tests fail closed without AWS/S3/EC2 contact","PASS_LOCAL_ONLY_REALESRGAN_ASSET_TRANSFER_DRY_RUN_BUNDLE","Plan/Instructions/QA/Evidence/Runtime_Readiness/W66_SDXL_REALESRGAN_UPSCALE_ASSET_TRANSFER_DRY_RUN_BUNDLE_20260710T113605-0500.json","Keep EC2 stopped; live S3 publish, EC2 install/static proof, bounded target output, pullback, strict visual QA, and final review remain explicit live gates"
"2026-07-10T11:25:34-05:00","66","selected-inpaint orchestrator reusable harness coverage","Added temp-isolated positive orchestration smoke, invalid-lane expected-failure smoke, direct parser coverage, and optional wrapper artifact-output directory; no external or mask action occurred","tools/Invoke-SelectedInpaintPreEC2Refresh.ps1; Plan/Instructions/Operations/Scripts/Test-OperationsHelperStatic.ps1; Plan/Instructions/QA/Evidence/Operations_Static_Validation/W66_SELECTED_INPAINT_REFRESH_ORCHESTRATOR_TEST_HARNESS_20260710T112400-0500.json; Plan/Tracker/Evidence/Operations_Static_Validation/W66_SELECTED_INPAINT_REFRESH_ORCHESTRATOR_TEST_HARNESS_20260710T112400-0500.json","Full operations helper harness: result=pass_local_only; script_count=37; parse_failures=0; local_smoke_count=30; local_smoke_failures=0; evidence/evidence-contract failures=0; positive and invalid-lane smokes pass","PASS_LOCAL_ONLY_W66_ORCHESTRATOR_REGRESSION_HARNESS","Plan/Instructions/QA/Evidence/Operations_Static_Validation/W66_SELECTED_INPAINT_REFRESH_ORCHESTRATOR_TEST_HARNESS_20260710T112400-0500.json","Do not rerun unless helper code changes; continue another concrete non-mask local task or obtain explicit live-window selection"
"2026-07-10T11:02:48-05:00","66","selected-inpaint deterministic pre-EC2 refresh orchestration","Added and ran one local-only wrapper that emits and contract-checks the selected pre-EC2 bundle, recheck ledger, live runbook, and execution snapshot under one stamp; no external or mask action occurred","tools/Invoke-SelectedInpaintPreEC2Refresh.ps1; Plan/Instructions/QA/Evidence/Runtime_Readiness/W66_SELECTED_INPAINT_PRE_EC2_REFRESH_ORCHESTRATION_20260710T110209-0500.json; Plan/Tracker/Evidence/Runtime_Readiness/W66_SELECTED_INPAINT_PRE_EC2_REFRESH_ORCHESTRATION_20260710T110209-0500.json","PowerShell parser pass; positive chain child_artifact_count=4 and failed_child_contract_count=0; invalid lane rejected; AWS/S3/EC2/ComfyUI/generation/execute/launch flags all false","PASS_LOCAL_ONLY_SELECTED_INPAINT_REFRESH_ORCHESTRATED_LIVE_GATES_CLOSED","Plan/Instructions/QA/Evidence/Runtime_Readiness/W66_SELECTED_INPAINT_PRE_EC2_REFRESH_ORCHESTRATION_20260710T110209-0500.json","Do not rerun without changed upstream inputs; keep EC2 stopped and continue concrete non-mask local work or obtain explicit live-window selection"
"2026-07-10T10:49:49-05:00","66","selected-inpaint pre-EC2 handoff refresh","Ran Cursor-first triage and refreshed the local-only selected-inpaint pre-EC2 handoff bundle at current clean HEAD; no EC2, S3 live execute, generation, mask promotion, Wave70 hard gate, Jira, or Wave71 action occurred","Plan/Instructions/QA/Evidence/Runtime_Readiness/W66_SELECTED_TARGET_RUNTIME_PRE_EC2_HANDOFF_BUNDLE_20260710T104949-0500.json; Plan/Instructions/QA/Evidence/Runtime_Readiness/W66_SELECTED_TARGET_RUNTIME_PRE_EC2_HANDOFF_BUNDLE_20260710T104949-0500.md; Plan/Tracker/Evidence/Runtime_Readiness/W66_SELECTED_TARGET_RUNTIME_PRE_EC2_HANDOFF_BUNDLE_20260710T104949-0500.json; runtime_artifacts/agent_handoffs/cursor/20260710T104610-0500_selected_inpaint_next_runtime_orchestration_triage/handoff_record.json","Cursor handoff status PASS; pre-EC2 handoff result pass_local_only_selected_target_runtime_pre_ec2_handoff_bundle_ready_ec2_blocked; failed_check_count=0; target_runtime_launch_allowed=false; execute_allowed_now=false; ec2_started=false; generation_executed=false","PASS_LOCAL_ONLY_PRE_EC2_HANDOFF_READY_EC2_BLOCKED","Plan/Instructions/QA/Evidence/Runtime_Readiness/W66_SELECTED_TARGET_RUNTIME_PRE_EC2_HANDOFF_BUNDLE_20260710T104949-0500.json","Keep EC2 stopped; continue local selected-inpaint orchestration rechecks or request explicit live-window selection before any S3 Execute, EC2 proof, marker write, or workflow smoke"
"2026-07-10T10:43:20-05:00","70","mf70_nose candidate policy W70-NOSE-CANDIDATE-POLICY-20260710T104320-0500","Recorded mf70_nose as gold-supported local candidate only; promotion and certification remain blocked","Plan/Instructions/QA/Evidence/Mask_Factory/Wave70/W70_NOSE_CANDIDATE_POLICY_DECISION_20260710T104320-0500.json; Plan/Tracker/Evidence/W70_NOSE_CANDIDATE_POLICY_DECISION_20260710T104320-0500.json","existing combined gold gate; postprocess route eval; local v5 visual QA; runtime evidence readback","CANDIDATE_SUPPORTED_POLICY_NO_PROMOTION","Plan/Instructions/QA/Evidence/Mask_Factory/Wave70/W70_NOSE_CANDIDATE_POLICY_DECISION_20260710T104320-0500.json","Continue concrete non-mask runtime/orchestration or another gold-backed row without consuming candidate masks as truth"
"2026-07-10T06:19:25-05:00","70","mf70 teeth mouth area anisotropic route search","Added and ran a local-only 6471-route anisotropic morphology/shift search for mf70_teeth_mouth_area after v2 failed combined gold; best route dilate_w9_h5_shifty1 still fails combined gold on IoU and LaPa false negatives, so morphology-only repair is blocked with no promotion","Plan/07_IMPLEMENTATION/scripts/search_wave70_teeth_mouth_area_anisotropic_routes.py; Plan/Instructions/QA/Evidence/Mask_Factory/Wave70/W70_MF70_TEETH_MOUTH_AREA_ANISOTROPIC_ROUTE_SEARCH_20260710T061925-0500.json; Plan/Tracker/Evidence/W70_MF70_TEETH_MOUTH_AREA_ANISOTROPIC_ROUTE_SEARCH_20260710T061925-0500.json; runtime_artifacts/mask_factory/wave70_teeth_mouth_area_anisotropic_routes/20260710T061925-0500/review_panels/mf70_teeth_mouth_area_dilate_w9_h5_shifty1_panel.png; runtime_artifacts/mask_factory/wave70_teeth_mouth_area_anisotropic_routes/20260710T061925-0500/best_route_masks; Plan/Instructions/Hydration_Rehydration/CURRENT_PURSUING_GOAL.md; Plan/Instructions/Hydration_Rehydration/NEXT_ACTION.md; Plan/Instructions/Hydration_Rehydration/CURRENT_SESSION_STATE.md; Plan/Instructions/Hydration_Rehydration/RESUME_HERE_NEXT_CODEX_SESSION.md; Plan/Instructions/Hydration_Rehydration/QA_EVIDENCE_INDEX.md; Plan/Instructions/Hydration_Rehydration/RECENT_DECISIONS.md; Plan/Instructions/Hydration_Rehydration/PROOF_OF_MOVEMENT_LOG.csv","Python py_compile pass; route search run pass; QA JSON parse pass; Tracker mirror parse pass; review panel exists; 8 best-route masks emitted; local_only=true; ec2_started=false; generation_executed=false; active_input_mask_overwritten=false; mask_promoted=false","BLOCKED_MORPHOLOGY_ONLY_NO_PROMOTION","Plan/Instructions/QA/Evidence/Mask_Factory/Wave70/W70_MF70_TEETH_MOUTH_AREA_ANISOTROPIC_ROUTE_SEARCH_20260710T061925-0500.json","Use a non-morphology mouth-interior boundary route, write an explicit row policy if justified, or switch to another blocked facial/body row"
"2026-07-10T06:11:35-05:00","70","mf70 teeth mouth area v2 combined gold evaluation","Added and ran a local-only combined-gold evaluator for the existing mf70_teeth_mouth_area v2 erode/dilate route; proved v2 passes CelebAMask-HQ but fails LaPa and therefore cannot be promoted or treated as combined-gold-supported despite earlier target-specific local proof","Plan/07_IMPLEMENTATION/scripts/evaluate_wave70_teeth_mouth_area_v2_combined_gold.py; Plan/Instructions/QA/Evidence/Mask_Factory/Wave70/W70_MF70_TEETH_MOUTH_AREA_V2_COMBINED_GOLD_EVAL_20260710T061135-0500.json; Plan/Tracker/Evidence/W70_MF70_TEETH_MOUTH_AREA_V2_COMBINED_GOLD_EVAL_20260710T061135-0500.json; runtime_artifacts/mask_factory/wave70_teeth_mouth_area_v2_combined_gold/20260710T061135-0500/review_panels/mf70_teeth_mouth_area_v2_combined_gold_panel.png; runtime_artifacts/mask_factory/wave70_teeth_mouth_area_v2_combined_gold/20260710T061135-0500/route_masks; Plan/Instructions/Hydration_Rehydration/CURRENT_PURSUING_GOAL.md; Plan/Instructions/Hydration_Rehydration/NEXT_ACTION.md; Plan/Instructions/Hydration_Rehydration/CURRENT_SESSION_STATE.md; Plan/Instructions/Hydration_Rehydration/RESUME_HERE_NEXT_CODEX_SESSION.md; Plan/Instructions/Hydration_Rehydration/QA_EVIDENCE_INDEX.md; Plan/Instructions/Hydration_Rehydration/RECENT_DECISIONS.md; Plan/Instructions/Hydration_Rehydration/PROOF_OF_MOVEMENT_LOG.csv","Python py_compile pass; evaluator run pass; QA JSON parse pass; Tracker mirror parse pass; review panel exists; 11 route masks emitted; local_only=true; ec2_started=false; generation_executed=false; active_input_mask_overwritten=false; mask_promoted=false","BLOCKED_COMBINED_GOLD_NO_PROMOTION","Plan/Instructions/QA/Evidence/Mask_Factory/Wave70/W70_MF70_TEETH_MOUTH_AREA_V2_COMBINED_GOLD_EVAL_20260710T061135-0500.json","Design a stronger mf70_teeth_mouth_area mouth-interior boundary route, write an explicit row policy, or switch to another blocked facial/body row with a new gold-backed route"
"2026-07-10T06:02:00-05:00","70","eyebrow dataset runtime policy decision","Added and ran a local-only mf70_eyebrows policy decision script; selected fail_closed_until_stronger_parser_or_new_row because both CelebAMask-HQ and LaPa block current eyebrow routes, no stronger local automatic eyebrow parser is registered, and generated portrait overlays are not pass authority","Plan/07_IMPLEMENTATION/scripts/decide_wave70_eyebrow_dataset_runtime_policy.py; Plan/Instructions/QA/Evidence/Mask_Factory/Wave70/W70_EYEBROW_DATASET_RUNTIME_POLICY_DECISION_20260710T060200-0500.json; Plan/Tracker/Evidence/W70_EYEBROW_DATASET_RUNTIME_POLICY_DECISION_20260710T060200-0500.json; Plan/Instructions/Hydration_Rehydration/CURRENT_PURSUING_GOAL.md; Plan/Instructions/Hydration_Rehydration/NEXT_ACTION.md; Plan/Instructions/Hydration_Rehydration/CURRENT_SESSION_STATE.md; Plan/Instructions/Hydration_Rehydration/RESUME_HERE_NEXT_CODEX_SESSION.md; Plan/Instructions/Hydration_Rehydration/QA_EVIDENCE_INDEX.md; Plan/Instructions/Hydration_Rehydration/RECENT_DECISIONS.md; Plan/Instructions/Hydration_Rehydration/PROOF_OF_MOVEMENT_LOG.csv","Python py_compile pass; policy script run pass; QA JSON parse pass; Tracker mirror parse pass; local_only=true; ec2_started=false; generation_executed=false; active_input_mask_overwritten=false; mask_promoted=false","FAIL_CLOSED_NO_DATASET_SPLIT_PROMOTION","Plan/Instructions/QA/Evidence/Mask_Factory/Wave70/W70_EYEBROW_DATASET_RUNTIME_POLICY_DECISION_20260710T060200-0500.json","Switch to another blocked facial/body row with a genuinely new gold-backed route, or resume eyebrows only after registering and validating a stronger eyebrow semantic parser"
"2026-07-10T05:53:08-05:00","70","eyebrow semantic parser options audit","Added and ran a local-only parser-options audit after gold-backed eyebrow route failures; recorded that no registered local asset is a stronger automatic eyebrow semantic parser than the failed BiSeNet-backed route; kept MaskedWarehouse gold data as authority and did not promote masks or use generated portrait proof","Plan/07_IMPLEMENTATION/scripts/audit_wave70_eyebrow_semantic_parser_options.py; Plan/Instructions/QA/Evidence/Mask_Factory/Wave70/W70_EYEBROW_SEMANTIC_PARSER_OPTIONS_AUDIT_20260710T055308-0500.json; Plan/Tracker/Evidence/W70_EYEBROW_SEMANTIC_PARSER_OPTIONS_AUDIT_20260710T055308-0500.json; Plan/Instructions/Hydration_Rehydration/CURRENT_PURSUING_GOAL.md; Plan/Instructions/Hydration_Rehydration/NEXT_ACTION.md; Plan/Instructions/Hydration_Rehydration/CURRENT_SESSION_STATE.md; Plan/Instructions/Hydration_Rehydration/RESUME_HERE_NEXT_CODEX_SESSION.md; Plan/Instructions/Hydration_Rehydration/QA_EVIDENCE_INDEX.md; Plan/Instructions/Hydration_Rehydration/RECENT_DECISIONS.md; Plan/Instructions/Hydration_Rehydration/PROOF_OF_MOVEMENT_LOG.csv","Python py_compile pass; audit run pass; QA JSON parse pass; Tracker mirror parse pass; local_only=true; ec2_started=false; generation_executed=false; active_input_mask_overwritten=false; mask_promoted=false","BLOCKED_LOCAL_PARSER_OPTIONS_NO_PROMOTION","Plan/Instructions/QA/Evidence/Mask_Factory/Wave70/W70_EYEBROW_SEMANTIC_PARSER_OPTIONS_AUDIT_20260710T055308-0500.json","Define eyebrow dataset-vs-runtime policy, register and validate a stronger face parser with eyebrow labels, or switch to another blocked facial/body row with a new gold-backed route"
